job_url,site,title,company,company_url,location,job_type,date_posted,interval,min_amount,max_amount,currency,is_remote,num_urgent_words,benefits,emails,description
https://www.indeed.com/viewjob?jk=ebfcb1c5d8ef5268,indeed,Senior Product Manager,Amazon.com Services LLC,https://www.indeed.com/cmp/Amazon.com,"Bellevue, WA, USA",fulltime,2023-10-29,yearly,125700,-1,USD,False,0,,,"6+ years of professional non-internship marketing experience Experience managing teams Experience using data and metrics to drive improvements Experience with Excel or Tableau (data manipulation, macros, charts and pivot tables) Experience driving direction and alignment with cross-functional teams Are you interested in being part of team that is helping Amazon enter an emerging market segment with incredible potential? Are you the kind of person who thrives in an environment where you get to invent on behalf of customers every day? Are you able to quickly analyze customer data to identify meaningful, actionable insights that improve business performance? Do you have a successful track record of defining high impact campaigns for consumer products? Do you have a knack for creating high quality marketing deliverables that crisply convey customer value propositions? Bring your entrepreneurial mindset and drive to deliver results to the Amazon Luna Sales and Marketing team! As a Principal Product Marketing Manager, you will develop and deliver partner marketing programs that enable the Luna business to grow through and with partners. You will own defining, developing, executing and analyze high-impact co-marketing campaigns with top tier game developers, game publishers and other partners to acquire new customers, retain and grow existing customers and deliver subscriber and revenue growth. You will collaborate across our BD, Product, and Engineering teams to establish strong, collaborative, “trusted advisor” relationships with partners through the recruiting, GTM and customer activation lifecycle. Our growth requires a leader who makes sound decisions at speed, has a true “owner” mentality, brings a relentless focus to getting things done, and thrives on breaking down and solving complex problems. We are seeking someone who is creative, highly analytical, customer-obsessed, and excels at earning trust with stakeholders. The right candidate will have demonstrated experience in developing go-to-market and/or co-marketing programs. They will have a proven record of leading and driving multiple programs to meet business objectives, excellent program and project management skills, a customer-obsessed and collaborative approach, strong data and metrics bias, be a self-starter, comfortable with ambiguity in a fast-paced and ever-changing environment and be passionate about launching new products and experiences for consumers. Key job responsibilities Drive growth and scale for Amazon Luna by leading go-to-market planning and launching world-class co-marketing campaigns with third-party content partners that are impactful to the business, drive growth and increase brand and product awareness. Develop detailed campaign project plans, including campaign goals, messaging, call-to-action, marketing distribution channels, follow-up activities, and success metrics. Present new partner marketing proposals and analysis of active campaigns in recurring business reviews with senior leadership. Help improve and build new go-to-market mechanisms including playbooks, toolkits, and processes to enable the team to scale more effectively and efficiently across new partners, channels and regions Inform the product roadmap with customer and partner insights to influence the product roadmap and drive innovation. We are open to hiring candidates to work out of one of the following locations: Bellevue, WA, USA | Irvine, CA, USA Experience working with multiple groups of stakeholders Experience in e-commerce, digital products or entertainment industries Amazon is committed to a diverse and inclusive workplace. Amazon is an equal opportunity employer and does not discriminate on the basis of race, national origin, gender, gender identity, sexual orientation, protected veteran status, disability, age, or other legally protected status. For individuals with disabilities who would like to request an accommodation, please visit https://www.amazon.jobs/en/disability/us. Our compensation reflects the cost of labor across several US geographic markets. The base pay for this position ranges from $125,700/year in our lowest geographic market up to $233,800/year in our highest geographic market. Pay is based on a number of factors including market location and may vary depending on job-related knowledge, skills, and experience. Amazon is a total compensation company. Dependent on the position offered, equity, sign-on payments, and other forms of compensation may be provided as part of a total compensation package, in addition to a full range of medical, financial, and/or other benefits. For more information, please visit https://www.aboutamazon.com/workplace/employee-benefits. Applicants should apply via our internal or external career site."
https://www.indeed.com/viewjob?jk=5a7b0d008973b7b8,indeed,Technical Program Manager,Amazon.com Services LLC,https://www.indeed.com/cmp/Amazon.com,"Seattle, WA, USA",fulltime,2023-11-29,yearly,119000,-1,USD,False,0,,,"7+ years of working directly with engineering teams experience 5+ years of technical product or program management experience 3+ years of software development experience 5+ years of technical program management working directly with software engineering teams experience Experience managing programs across cross functional teams, building processes and coordinating release schedules Come build the future as a Technical Program Manager III at Amazon, where you will be inspired working alongside best-in-class inventors and innovators! You will have the opportunity to create meaningful experiences that deliver on the ever-evolving needs of our customers, and your work will impact millions of people around the world. Apply now and you will be eligible for Amazon Technical Program Manager III positions that are based on your preferred location, team, tech stack, domain, language and more. We’re hiring across Amazon Stores in the United States and Canada. Teams with available positions including, but are not limited to: Consumer Technology: Build new generation features and products for amazon.com, constantly improving the Customer and Seller experience for billions around the globe. Whether building site wide features such as reviews and recommendations, category specific software for the likes of Pharmacy, Electronics, Digital Software and Video Games or seller infrastructure, there are a variety of complex problems to tackle using a range of technologies in the design of your technical solutions. Operations Technology: Shape the future of transportation planning and execution on a global scale, that impacts hundreds of fulfillment centers, thousands of Amazonians, and millions of customers across the world. Your technology will support thousands of operators worldwide to design, build and run the best-in-class Amazon transportation network. We are building intelligent software to make transportation more reliable, faster, and less costly, providing a better and less expensive experience for our customers. Financial Technology: Create next generation of distributed, scalable financial systems that support Amazon's current and future business needs. Use big data technologies to design and develop services that facilitate global financial transactions worth billions annually. You’ll lead architecture, design, implementation and deployment of large-scale critical and complex financial applications, owning all aspects of solutions end-to-end, through full stack software development. Human Resources Technology: Create a seamless experience for millions of Amazonians and/or candidates. Whether supporting technologies for onboarding, time and attendance, compensation, amazon.jobs, or recruiting, you’ll deliver robust feature sets, elegant designs, intuitive user interfaces and systems that make it easy for Amazonians to excel at performing critical business functions. Depending on your experience, Technical Program Manager III can typically expect to directly engage with developers and customers to address challenging problems, build software with the latest technologies and make data-driven decisions to improve the customer experience. Your responsibilities extend to scaling systems by managing internal and external stakeholders across various domains, from business and operations to engineering, science, and deployment. As a Senior TPM, you will navigate bottlenecks, provide escalation management, make strategic tradeoffs, and balance business needs with technical constraints. The role also involves scoping and delivering large projects end-to-end, collecting requirements, writing specifications, and coordinating design/implementation efforts. Ideally, you possess a strong program management background, demonstrated experience leading medium to large projects, and a well-rounded technical proficiency in current web technologies. About Us Work/Life Balance Our team puts a high value on work-life balance. It isn’t about how many hours you spend at home or at work; it’s about the flow you establish that brings energy to both parts of your life. We believe striking the right balance between your personal and professional life is critical to life-long happiness and fulfillment. We offer flexibility in working hours and encourage you to find your own balance between your work and personal lives. Mentorship & Career Growth Our team is dedicated to supporting new members. We have a broad mix of experience levels and tenures, and we’re building an environment that celebrates knowledge sharing and mentorship. We care about your career growth and strive to assign opportunities based on what will help each team member develop into a better-rounded contributor. Inclusive Team Culture Here at Amazon, we embrace our differences. We are committed to furthering our culture of inclusion. We have ten employee-led affinity groups, reaching 40,000 employees in over 190 chapters globally. We have innovative benefit offerings, and host annual and ongoing learning experiences, including our Conversations on Race and Ethnicity (CORE) and AmazeCon (gender diversity) conferences. Amazon’s culture of inclusion is reinforced within our 14 Leadership Principles, which remind team members to seek diverse perspectives, learn and be curious, and earn trust. We are open to hiring candidates to work out of one of the following locations: Arlington, VA, USA | Austin, TX, USA | Bellevue, WA, USA | Boston, MA, USA | Dallas, TX, USA | Nashville, TN, USA | Palo Alto, CA, USA | Seattle, WA, USA | Sunnyvale, CA, USA 5+ years of project management disciplines including scope, schedule, budget, quality, along with risk and critical path management experience Experience managing projects across cross functional teams, building sustainable processes and coordinating release schedules Experience defining KPI's/SLA's used to drive multi-million dollar businesses and reporting to senior leadership Amazon is committed to a diverse and inclusive workplace. Amazon is an equal opportunity employer and does not discriminate on the basis of race, national origin, gender, gender identity, sexual orientation, protected veteran status, disability, age, or other legally protected status. For individuals with disabilities who would like to request an accommodation, please visit https://www.amazon.jobs/en/disability/us. Our compensation reflects the cost of labor across several US geographic markets. The base pay for this position ranges from $119,000/year in our lowest geographic market up to $231,400/year in our highest geographic market. Pay is based on a number of factors including market location and may vary depending on job-related knowledge, skills, and experience. Amazon is a total compensation company. Dependent on the position offered, equity, sign-on payments, and other forms of compensation may be provided as part of a total compensation package, in addition to a full range of medical, financial, and/or other benefits. For more information, please visit https://www.aboutamazon.com/workplace/employee-benefits. Applicants should apply via our internal or external career site."
https://www.indeed.com/viewjob?jk=fe931004cde6615f,indeed,Technical Program Manager,Amazon.com Services LLC,https://www.indeed.com/cmp/Amazon.com,"Seattle, WA, USA",fulltime,2023-11-28,yearly,119000,-1,USD,False,0,,,"7+ years of working directly with engineering teams experience 5+ years of technical product or program management experience 3+ years of software development experience 5+ years of technical program management working directly with software engineering teams experience Experience managing programs across cross functional teams, building processes and coordinating release schedules About Us Work/Life Balance Our team puts a high value on work-life balance. It isn’t about how many hours you spend at home or at work; it’s about the flow you establish that brings energy to both parts of your life. We believe striking the right balance between your personal and professional life is critical to life-long happiness and fulfillment. We offer flexibility in working hours and encourage you to find your own balance between your work and personal lives. Mentorship & Career Growth Our team is dedicated to supporting new members. We have a broad mix of experience levels and tenures, and we’re building an environment that celebrates knowledge sharing and mentorship. We care about your career growth and strive to assign opportunities based on what will help each team member develop into a better-rounded contributor. Inclusive Team Culture Here at Amazon, we embrace our differences. We are committed to furthering our culture of inclusion. We have ten employee-led affinity groups, reaching 40,000 employees in over 190 chapters globally. We have innovative benefit offerings, and host annual and ongoing learning experiences, including our Conversations on Race and Ethnicity (CORE) and AmazeCon (gender diversity) conferences. Amazon’s culture of inclusion is reinforced within our 14 Leadership Principles, which remind team members to seek diverse perspectives, learn and be curious, and earn trust. Come build the future as a Technical Program Manager III at Amazon, where you will be inspired working alongside best-in-class inventors and innovators! You will have the opportunity to create meaningful experiences that deliver on the ever-evolving needs of our customers, and your work will impact millions of people around the world. Apply now and you will be eligible for Amazon Technical Program Manager III positions that are based on your preferred location, team, tech stack, domain, language and more. We’re hiring across Amazon Stores in the United States and Canada. Teams with available positions including, but are not limited to: Consumer Technology: Build new generation features and products for amazon.com, constantly improving the Customer and Seller experience for billions around the globe. Whether building site wide features such as reviews and recommendations, category specific software for the likes of Pharmacy, Electronics, Digital Software and Video Games or seller infrastructure, there are a variety of complex problems to tackle using a range of technologies in the design of your technical solutions. Operations Technology: Shape the future of transportation planning and execution on a global scale, that impacts hundreds of fulfillment centers, thousands of Amazonians, and millions of customers across the world. Your technology will support thousands of operators worldwide to design, build and run the best-in-class Amazon transportation network. We are building intelligent software to make transportation more reliable, faster, and less costly, providing a better and less expensive experience for our customers. Financial Technology: Create next generation of distributed, scalable financial systems that support Amazon's current and future business needs. Use big data technologies to design and develop services that facilitate global financial transactions worth billions annually. You’ll lead architecture, design, implementation and deployment of large-scale critical and complex financial applications, owning all aspects of solutions end-to-end, through full stack software development. Human Resources Technology: Create a seamless experience for millions of Amazonians and/or candidates. Whether supporting technologies for onboarding, time and attendance, compensation, amazon.jobs, or recruiting, you’ll deliver robust feature sets, elegant designs, intuitive user interfaces and systems that make it easy for Amazonians to excel at performing critical business functions. Key job responsibilities Depending on your experience, Technical Program Manager III can typically expect to directly engage with developers and customers to address challenging problems, build software with the latest technologies and make data-driven decisions to improve the customer experience. Your responsibilities extend to scaling systems by managing internal and external stakeholders across various domains, from business and operations to engineering, science, and deployment. As a Senior TPM, you will navigate bottlenecks, provide escalation management, make strategic tradeoffs, and balance business needs with technical constraints. The role also involves scoping and delivering large projects end-to-end, collecting requirements, writing specifications, and coordinating design/implementation efforts. Ideally, you possess a strong program management background, demonstrated experience leading medium to large projects, and a well-rounded technical proficiency in current web technologies. We are open to hiring candidates to work out of one of the following locations: Arlington, VA, USA | Austin, TX, USA | Bellevue, WA, USA | Boston, MA, USA | Dallas, TX, USA | Nashville, TN, USA | Palo Alto, CA, USA | Seattle, WA, USA | Sunnyvale, CA, USA 5+ years of project management disciplines including scope, schedule, budget, quality, along with risk and critical path management experience Experience managing projects across cross functional teams, building sustainable processes and coordinating release schedules Experience defining KPI's/SLA's used to drive multi-million dollar businesses and reporting to senior leadership Amazon is committed to a diverse and inclusive workplace. Amazon is an equal opportunity employer and does not discriminate on the basis of race, national origin, gender, gender identity, sexual orientation, protected veteran status, disability, age, or other legally protected status. For individuals with disabilities who would like to request an accommodation, please visit https://www.amazon.jobs/en/disability/us. Our compensation reflects the cost of labor across several US geographic markets. The base pay for this position ranges from $119,000/year in our lowest geographic market up to $231,400/year in our highest geographic market. Pay is based on a number of factors including market location and may vary depending on job-related knowledge, skills, and experience. Amazon is a total compensation company. Dependent on the position offered, equity, sign-on payments, and other forms of compensation may be provided as part of a total compensation package, in addition to a full range of medical, financial, and/or other benefits. For more information, please visit https://www.aboutamazon.com/workplace/employee-benefits. Applicants should apply via our internal or external career site."
https://www.indeed.com/viewjob?jk=187a748d081d18cc,indeed,Senior Program Manager,Amazon.com Services LLC,https://www.indeed.com/cmp/Amazon.com,"Seattle, WA, USA",fulltime,2023-10-18,yearly,92500,-1,USD,False,0,,,"5+ years of program or project management experience Experience using data and metrics to determine and drive improvements Experience owning program strategy, end to end delivery, and communicating results to senior leadership Interested in Android apps and devices such as Amazon’s Fire Tablets and Fire TV? Are you excited by the sense of ownership to manage projects at Amazonian scale? Do you enjoy working in a fast-paced environment to solve complex operational problems by delivering innovative solutions? In the Amazon Appstore team, we entertain, and delight across devices with a vast selection of relevant apps, games, and services by making it trivially easy for developers to deliver. Amazon Appstore Policy team is seeking an enthusiastic, detail-oriented policy manager for our global program focusing on policy governance and enforcement, consistency and scalability within Amazon. Devices are becoming increasingly sophisticated , and they are enabling customers to access content, applications, and services anywhere. This team researches, recommends, and develops the policies that govern, which apps are available from Amazon's global Appstore. Key job responsibilities The Sr Program Manager will work closely with Amazon leadership to set the long-term vision to support a trusted and safe environment for our customers, assess risk, and manage the consistent and accurate enforcement of our appstore policies worldwide. In this role you will continuously evaluate Appstore policies and standards, policy governance, enforcement, and escalation processes. You will be the voice of our policies and standards for developers, and internal customers, to ensure a broad understanding of the intent, philosophy, and customer obsession behind the policy decisions we make. You will work closely with our product, operations and engineering teams to improve policy mechanisms, analyze data to prioritize tool improvements, and help set the vision for automated review to enable policy governance at scale. You will lead a small team of policy program managers. As a Sr Program Manager, you will own Appstore Policy and work with globally-based teams to make things happen. You will deliver results when faced with ambiguous circumstances and roadblocks. Your judgment and intuition are right, a lot, and you know when to ask the right questions. We start with the customer and work backwards in everything we do. Develop policies that protect Amazon, our customers, and developers Build escalation tools and handle policy escalations from developers, business development teams, PR, and other internal stakeholders Prepare and deliver business reviews to executive leadership and business team regarding program/project progress and roadblocks Define program and organization wide metrics and ambitious goals Partner and influence product and engineering teams to drive solutions that scale and accurately enforce our policies Make balanced decisions content moderation questions Develop policies and governance frameworks to identify and resolve escalation scenarios Hire and develop a small team of policy program managers A day in the life We are looking for an energetic Sr Program Manager to come and lead some of the key initiatives within Appstore Policy. This is a strategic role to shape and deliver our vision in developing and delivering global program focusing on Appstore policy governance About the team EDS (Entertainment, Devices and Services) org’s mission is help hundreds of millions of people around the world relax, be entertained, and make their lives easier. The policy governance team works with the policy enforcement (tablets & fire tv) operationalizing, optimizing and improving execution frameworks for processes and technologies. We are open to hiring candidates to work out of one of the following locations: Seattle, WA, USA 2+ years of driving process improvements experience Master's degree, or MBA in business, operations, human resources, adult education, organizational development, instructional design or related field Amazon is committed to a diverse and inclusive workplace. Amazon is an equal opportunity employer and does not discriminate on the basis of race, national origin, gender, gender identity, sexual orientation, protected veteran status, disability, age, or other legally protected status. For individuals with disabilities who would like to request an accommodation, please visit https://www.amazon.jobs/en/disability/us. Our compensation reflects the cost of labor across several US geographic markets. The base pay for this position ranges from $92,500/year in our lowest geographic market up to $185,000/year in our highest geographic market. Pay is based on a number of factors including market location and may vary depending on job-related knowledge, skills, and experience. Amazon is a total compensation company. Dependent on the position offered, equity, sign-on payments, and other forms of compensation may be provided as part of a total compensation package, in addition to a full range of medical, financial, and/or other benefits. For more information, please visit https://www.aboutamazon.com/workplace/employee-benefits. Applicants should apply via our internal or external career site."
