job_url,site,title,company,company_url,location,job_type,date_posted,interval,min_amount,max_amount,currency,is_remote,num_urgent_words,benefits,emails,description
https://www.ziprecruiter.com/k/l/AALWaspLtplpFxBWC2ECaG6OZXDAAXL6_Jbb3Pilco48tWS8FVuNxPmVKzckW_V_3XIsKoqrW7hh4UmNcZbUlear1KxKjaiT7uHFW57MLtZNXtW8Mr2Y4iBWUwxeDrJIGCDEId66EjUBza9pDVwhK6qsydM-3N66WBU8YUHVmaHRx6azC6fFm6MaZgAUXIhwNgN2bv_BkLMBCJmzZ6rxdQ,zip_recruiter,Senior Game Engineer,PIKEMANN LLC,,"Seattle, WA, USA",fulltime,2023-12-04,yearly,130000,130000,USD,,0,,,"Benefits and Perks:Generous PTOComprehensive Medical, Dental, & Vision coverageHealthcare and Dependent Care FSAs401k with company matchLife and Disability insuranceTechnology StipendPaid company holidays and office closuresProfit SharingPikemann is looking for a Game Engineer 3.Our client is an independent game studio based in Washington and has worked on popular AAA game titles for PC and console. They are looking for Senior Game Engineers to join their team. You will work closely with Engineers, Designers, Artists and Producers on their current game project. You will design and implement extensions to existing systems and pivotal new systems to address the needs of our team of content developers and external third-party partners.Design, author, and maintain robust and highly optimized systems that meet all design, technical and schedule requirements.Work closely with QA and technical leadership to ensure the stability and accuracy of systems by identifying, communicating and resolving defects.Author, review and provide feedback on technical and end-user documentation of systems.Collaborate with Technical Leadership and other Engineers to help establish overall technical design and architecture.Work with minimal guidance on medium-impact tasks or independently on low-risk tasksProvide guidance and informal supervision to more junior staffHelp team members set up tools and troubleshoot minor tools issues and workflow blockersQualifications:5+ years professional software development2+ years professional Unreal Engine experience2+ years developing in a team environmentStrong C++ knowledgeExtensive experience working in at least one large code baseAbility to openly discuss and review technical proposals, requirements, designs, algorithms, source code, and reference documents with engineers, content creators, and managersAbility to provide meaningful time estimates for medium-sized tasksAbility to take a large body of work and break up into actionable sub-tasksProficiency in identifying areas that could use optimizationExtensive experience using debugging tools to fix bugs in unfamiliar codeExpert knowledge in 3D mathAAA experience is a big plusFlexible work from home options available."
https://www.ziprecruiter.com/k/l/AAKvJGr2BYDF8q---wZttzPJyUKDfyPXEkcmiOOeFt6IlJ02YPDKdsauBPqdZZeqcgNjYpRBreI6ZH6y8NedCRpu_7r042R_02kcuKl2jtGGxwpD8dr3b-WegWIMXT3Qw-gulYYRadBCcixMoXRJdqDrBydxYoC0sVa8ktM_sbNbUy06eXyifuk9aLGrZjI3U4y2_kCKoOyk7_MFyXLteZg,zip_recruiter,Principal Gameplay Designer,ProbablyMonsters,,"Bellevue, WA, USA",,2023-12-04,yearly,16900,16900,USD,,0,,,Building a great team is as important as building a great game * A small team of veterans with ... You have significant knowledge of modern design workflows and love working with engineers and ...
https://www.indeed.com/viewjob?jk=1059c6ec427071bc,indeed,Software Engineer,PlayEveryWare,,"Seattle, WA, USA",fulltime,2023-12-03,yearly,125000,160000,USD,False,0,,,"Manager, Software Engineering At PlayEveryWare, no two projects are exactly alike. We work on cutting edge technology and bring games to previous and current generation consoles. Each project brings exciting new technical challenges and opportunities to learn, adapt, and grow. We invite you to join our team of experienced industry veterans to stretch the limits of your skills and push your expertise into new areas with these unique projects. As an Engineering Manager at PlayEveryWare, you'll play a pivotal role in shaping the future of our engineering team. Your responsibilities extend beyond project management to actively fostering the growth and development of each team member. You'll be instrumental in recruiting top talent, ensuring that our team not only maintains its high standards but also continues to evolve with the industry's best. Additionally, you'll be charged with continually assessing and refining our engineering processes. This role requires a balance of technical expertise, leadership acumen, and a visionary approach to team development and process innovation. Your contributions will directly impact the efficiency, effectiveness, and culture of our engineering team, making you a key driver of our continued success in the dynamic world of game development. If you excel in leading teams towards innovative solutions, are adept at navigating and improving complex systems, and possess exceptional strategic, technical, and communication skills, we invite you to lead our team to new heights. Responsibilities Guide and mentor software engineers from multiple teams, fostering an environment of growth and development Work with technical leads to help them guide the architecture, design, and development of software systems, ensuring alignment with project goals and company standards Manage project timelines, resources, and deliverables in collaboration with other departments Conduct code reviews and maintain high standards of code quality and system reliability Facilitate effective communication and collaboration within the team and with external partners Develop and implement strategies for continuous improvement in development processes and team performance Foster leadership and ownership throughout the studio Guide teams in problem-solving and decision-making for technical challenges Contribute to the recruitment, hiring, and onboarding of engineers Contribute to fostering a healthy satisfied team and sustainable company culture that is aligned with the company’s values Cultivate a proactive work culture and lead by example to anticipate challenges, streamline processes, and ensure timely resolution of issues Qualifications 5+ years of experience in the games industry or 10+ years in a related field, demonstrating strong leadership and success in diverse codebases Deep proficiency in C/C++ and familiarity with multiplatform development 2+ years of experience with Unreal Engine (UE4/UE5) Expertise in Perforce and Git version control systems Excellent problem-solving, organizational, and communication skills Proven ability in project risk management, task organization, and milestone operationalization Strong adaptability, task management, and delegation skills Experience developing on game consoles and proficient in debugging across multiple devices BA/BS or MS in Computer Science, or equivalent experience Commitment to studio values, including active listening, empathy, and servant leadership Vast technical knowledge across multiple engineering disciplines Nice to have 2+ years of professional experience with Unity and a strong command of C# Experience shipping at least one high-profile or professional game title in UE4 Development experience on current-generation game consoles, with a history of leading engineering teams in console development Proficiency in Japanese for communication with teams and partners Benefits & Perks 100% covered health care, vision, dental insurance with affordable options for addition of dependents 401(k) retirement savings and profit sharing plan Life and disability insurance, Healthcare Savings Account 56 hours of sick time, 11 floating holidays, and additional PTO No Mandatory Crunch policy Close relationships with Epic, Unity, and first-party console developers Open and collaborative workspace with available on-site parking and gym Subsidized ORCA transit card for employees working 3 days in the office Casual and inclusive office environment nearby cafes and restaurants Company events, SWAG, and snack stocked kitchen Friday team lunch Job Type: Full-time Pay: $125,000.00 - $160,000.00 per year Benefits: 401(k) Dental insurance Health insurance Work Location: Hybrid remote in Seattle, WA 98108"
https://www.indeed.com/viewjob?jk=1743fb7c6801e3a5,indeed,Senior Software Engineer,PlayEveryWare,,"Seattle, WA, USA",fulltime,2023-12-03,yearly,115000,150000,USD,True,0,,,"Software Engineer As a Senior Software Engineer at PlayEveryWare, you’ll work alongside internal and client engineers on indie and AAA teams to implement and iterate on a wide variety of features and systems. You’ll face technical challenges you haven’t seen before and solve problems that few others have encountered– rapidly expanding your portfolio and areas of expertise. If you’re comfortable learning new technologies and codebases, and you have strong detective, documentation, and communication skills, we would love to welcome you to our team! Responsibilities Establish and own software systems for multiplatform internal and external projects through architecture, design, and development Debug code with precision, diagnosing and fixing bugs on multiple platforms Coordinate with engineering teammates and leaders on tasks, bug-fixes, and code reviews Help establish and extend good coding practices, as needed Direct the creation and maintenance of project and technical documentation Maintain alignment of technical requirements across project participants, internal, and external stakeholders Foster professional communication with external partners through clear, accountable, and transparent meetings and documentation Qualifications 5+ years experience in the games industry or 10+ years in a related industry 3+ years of deep professional experience in in C/C++ 2+ years of professional experience using Unreal Engine (UE4/UE5) Command of Perforce and Git version control for large code bases Proven track record of success in a wide variety of existing codebases with exemplary code comprehension Strong sense of leadership, self-awareness, adaptability, task management, and delegation Outstanding overall communication skills Development experience on one or more game consoles Excellent debugging skills across multiple devices BA/BS or MS Degree in Computer Science, or equivalent experience Nice to have 2+ years of professional experience with Unity Strong command of C# Experience shipping at least one high-profile or professional game title in UE4 Development experience on current generation game consoles Previous experience leading a team of engineers in console development Proficiency in a variety of programming languages This role is open to multiple levels based on experience and skills for the job Washington State Pay Range $115,000—$150,000 USD Benefits & Perks 100% covered health care, vision, dental insurance with affordable options for addition of dependents 401(k) retirement savings and profit sharing plan Life and disability insurance, Healthcare Savings Account 56 hours of sick time, 11 floating holidays, and additional PTO No Mandatory Crunch policy Close relationships with Epic, Unity, and first-party console developers Open and collaborative workspace with available on-site parking and gym Subsidized ORCA transit card for employees working 3 days in the office Casual and inclusive office environment nearby cafes and restaurants Company events, SWAG, and snack stocked kitchen Friday team lunch Job Type: Full-time Pay: $115,000.00 - $150,000.00 per year Benefits: 401(k) Dental insurance Health insurance Experience level: 5 years Schedule: 8 hour shift Monday to Friday Work Location: Hybrid remote in Seattle, WA 98108"
https://www.indeed.com/viewjob?jk=faefeffd52bce925,indeed,Quality Assurance Tester,ArenaNet,https://www.indeed.com/cmp/Arenanet,"Bellevue, WA, USA",,2023-11-30,yearly,38430,51880,USD,False,0,,,"We're ArenaNet. We make the games we want to play and infuse them with innovation, hand-crafted detail, and creative passion. As developer and publisher of the award-winning Guild Wars game series, we're proud to share our passion for the online worlds we've created with over 11 million players worldwide. We are looking for a QA Tester to test all aspects and systems of all assigned games to ensure that they meet or exceed quality standards. As a QA Tester, you will record bugs and report them in the appropriate tracking software. WHAT YOU'LL DO Using established methods, test games for ease of use, reliability, consistency, and absence of defects Execute functionality test plans and checklists Log and regress all defects found during testing into the appropriate defect tracking software Provide clear and detailed written reports of bugs and repro steps to the development team Bring serious defects to the attention of QA Leadership WHAT YOU'LL NEED TO BE SUCCESSFUL High school diploma or an equivalent combination of education, training, and experience 1-3 years of experience with software QA testing, preferably video game QA testing Strong attention to detail Excellent written and verbal communication skills Able to multi-task and work successfully under tight deadlines Computer proficiency, especially in relation to video games Working knowledge of Microsoft Office Familiar with Jira or another bug-tracking system Interested in and comfortable with MMO gaming Working knowledge of Zephyr or comparable test case management product This is a hybrid position based out of our Bellevue, WA office. Total compensation is salary plus annual bonus potential. Please note that the listed pay range is a general guideline only. We take into consideration your experience and qualifications when determining final salary. This role is also eligible for medical, dental, vision and life insurance, short and long term disability, 401(k), flexible and dependent care spending accounts, PTO, paid holidays and parental leave. Bellevue pay range $38,430—$51,880 USD"
https://www.indeed.com/viewjob?jk=3cb27752dce6ab6d,indeed,Principal Software Engineer,Microsoft,https://www.indeed.com/cmp/Microsoft,"Redmond, WA, USA",fulltime,2023-11-30,yearly,133600,256800,USD,False,0,,,"Would you like to be at the forefront of AI and Gaming and work with state-of-the-art AI research and the top gaming studios in the world? Are you a high-performance tech lead that loves to design and build world-changing products while leading and mentoring a team of developers? At Xbox Emerging Technologies, we are exploring new emerging technology trends to craft the next era of gaming. We are venturing beyond the horizon and charting a course forward with players and creators at the center. Our goal is to define the future of Xbox by advancing our mission of bringing joy and community to every player on the planet. If you value dynamic and agile teams that are proactively advocating for a diverse workforce, we have a great role for you. We are seeking a highly skilled Principal Software Development Engineer to join our team at Xbox Emerging Technology to lead the team that is building the next generation of game development tools powered by AI. As a key contributor, you will be responsible for driving innovation and excellence in software development, focusing on machine learning (ML) systems and developing scalable products that leverage the latest AI. You will play a pivotal role in delivering products in the gaming industry that empower developers to create the best games in the world. If you are a forward-thinking principal level engineer passionate about leadership in cutting-edge technology and possess an effective foundation in cloud, automation, ML, and AI, we encourage you to apply. At Xbox, we're committed to inclusivity and diversity. Even if you don't meet all qualifications listed, we welcome your application. Your unique perspective and potential contributions are highly valued here. Responsibilities Hands-on leadership of a team of product-focused software developers. Implementing AI models into scalable platforms that accelerate game development. Working across research, data science, and product management teams to ensure successful customer-centric solutions. Design and implement Azure based solutions to scale ML/AI solutions across Xbox. Craft clean, efficient, and maintainable code across a range of technologies, including but not limited to Python, PowerShell, C#, and C++. Qualifications Required Qualifications: Bachelor's Degree in Computer Science, or related technical discipline AND 6+ years technical engineering experience with coding in languages including, but not limited to, C, C++, C#, JavaScript, or Python OR equivalent experience. 3+ years experience leading cross-functional and/or cross-team projects. 4+ years of cloud-native software development experience. Preferred Qualifications: Ability to lead through example and influence. 10+ years of experience leading teams of software engineers. Effective problem-solving acumen and critical thinking skills. Experience in building new products or features from the ground up. Over 10 years of experience leading teams and building production level systems. Experience implementing RPA based solutions in Windows. Experience in videogame development, particularly in automation. Experience deploying, scaling, and managing containerized applications in Azure Previous exposure to Agile/Scrum development methodologies. Automation experience with Azure, particularly with Windows on Azure. Over 10 years of experience leading teams and building production level systems. Experience implementing RPA based solutions in Windows. Experience in videogame development, particularly in automation. Experience deploying, scaling, and managing containerized applications in Azure Previous exposure to Agile/Scrum development methodologies. Software Engineering M5 - The typical base pay range for this role across the U.S. is USD $133,600 - $256,800 per year. There is a different range applicable to specific work locations, within the San Francisco Bay area and New York City metropolitan area, and the base pay range for this role in those locations is USD $173,200 - $282,200 per year. Certain roles may be eligible for benefits and other compensation. Find additional benefits and pay information here: https://careers.microsoft.com/us/en/us-corporate-pay Microsoft is an equal opportunity employer. Consistent with applicable law, all qualified applicants will receive consideration for employment without regard to age, ancestry, citizenship, color, family or medical care leave, gender identity or expression, genetic information, immigration status, marital status, medical condition, national origin, physical or mental disability, political affiliation, protected veteran or military status, race, ethnicity, religion, sex (including pregnancy), sexual orientation, or any other characteristic protected by applicable local laws, regulations and ordinances. If you need assistance and/or a reasonable accommodation due to a disability during the application process, read more about requesting accommodations."
https://www.indeed.com/viewjob?jk=6dad82ca295d8907,indeed,Principal Product Manager,Amazon.com Services LLC,https://www.indeed.com/cmp/Amazon.com,"Bellevue, WA, USA",fulltime,2023-10-22,yearly,136000,-1,USD,False,0,,,"9+ years of professional non-internship marketing experience Experience using data and metrics to drive improvements Experience with Excel or Tableau (data manipulation, macros, charts and pivot tables) Experience building, executing and scaling cross-functional marketing programs Experience driving direction and alignment with cross-functional teams Are you interested in being part of team that is helping Amazon enter an emerging market segment with incredible potential? Are you the kind of person who thrives in an environment where you get to invent on behalf of customers every day? Are you able to quickly analyze customer data to identify meaningful, actionable insights that improve business performance? Do you have a successful track record of defining high impact campaigns for consumer products? Do you have a knack for creating high quality marketing deliverables that crisply convey customer value propositions? Bring your entrepreneurial mindset and drive to deliver results to the Amazon Luna Sales and Marketing team! As a Principal Product Marketing Manager, you will develop and deliver partner marketing programs that enable the Luna business to grow through and with partners. You will own defining, developing, executing and analyze high-impact co-marketing campaigns with top tier game developers, game publishers and other partners to acquire new customers, retain and grow existing customers and deliver subscriber and revenue growth. You will collaborate across our BD, Product, and Engineering teams to establish strong, collaborative, “trusted advisor” relationships with partners through the recruiting, GTM and customer activation lifecycle. Our growth requires a leader who makes sound decisions at speed, has a true “owner” mentality, brings a relentless focus to getting things done, and thrives on breaking down and solving complex problems. We are seeking someone who is creative, highly analytical, customer-obsessed, and excels at earning trust with stakeholders. The right candidate will have demonstrated experience in developing go-to-market and/or co-marketing programs. They will have a proven record of leading and driving multiple programs to meet business objectives, excellent program and project management skills, a customer-obsessed and collaborative approach, strong data and metrics bias, be a self-starter, comfortable with ambiguity in a fast-paced and ever-changing environment and be passionate about launching new products and experiences for consumers. Key job responsibilities Drive growth and scale for Amazon Luna by leading go-to-market planning and launching world-class co-marketing campaigns with third-party content partners that are impactful to the business, drive growth and increase brand and product awareness. Develop detailed campaign project plans, including campaign goals, messaging, call-to-action, marketing distribution channels, follow-up activities, and success metrics. Present new partner marketing proposals and analysis of active campaigns in recurring business reviews with senior leadership. Help improve and build new go-to-market mechanisms including playbooks, toolkits, and processes to enable the team to scale more effectively and efficiently across new partners, channels and regions Inform the product roadmap with customer and partner insights to influence the product roadmap and drive innovation. We are open to hiring candidates to work out of one of the following locations: Bellevue, WA, USA | Irvine, CA, USA Experience with creating GTM initiatives at scale Experience working cross-functionally across marketing, product management, analytics, UX, and research Amazon is committed to a diverse and inclusive workplace. Amazon is an equal opportunity employer and does not discriminate on the basis of race, national origin, gender, gender identity, sexual orientation, protected veteran status, disability, age, or other legally protected status. For individuals with disabilities who would like to request an accommodation, please visit https://www.amazon.jobs/en/disability/us. Our compensation reflects the cost of labor across several US geographic markets. The base pay for this position ranges from $136,000/year in our lowest geographic market up to $252,900/year in our highest geographic market. Pay is based on a number of factors including market location and may vary depending on job-related knowledge, skills, and experience. Amazon is a total compensation company. Dependent on the position offered, equity, sign-on payments, and other forms of compensation may be provided as part of a total compensation package, in addition to a full range of medical, financial, and/or other benefits. For more information, please visit https://www.aboutamazon.com/workplace/employee-benefits. Applicants should apply via our internal or external career site."
