job_url,site,title,company,company_url,location,job_type,date_posted,interval,min_amount,max_amount,currency,is_remote,num_urgent_words,benefits,emails,description
https://www.indeed.com/viewjob?jk=c6a52511f690e8f6,indeed,Senior Software Engineer,Electronic Arts,https://www.indeed.com/cmp/Electronic-Arts,"Seattle, WA, USA",fulltime,2023-11-29,yearly,136000,190850,USD,False,0,,,"Cliffhanger Games is a newly formed Seattle Studio focusing on blockbuster action-adventure games and pioneering next-generation emergent storytelling beginning with Marvel's Black Panther. Join us to pursue your passion to build unique, groundbreaking, and inclusive games that empower players to create incredible stories of heroic adventure. Become a foundational part of an ambitious, respectful and diverse team as we look for a Senior Infrastructure Engineer to join our team. You will build, maintain, and extend the production-grade tools and services that power our entire team’s development efforts. Applying a mix of Unreal Engine, Azure and proprietary internal tools, this engineer will strive to improve the developer experience ensuring optimal build tooling and artifact handling. You will also be trusted with handling the flow of new engine and tool versions into our development environment. You will report to our Tools Lead for technical guidance and an Engineering Manager to ensure professional growth and well-being. You will also have access to peers in similar roles across EA to learn from, collaborate with and grow. Responsibilities Collaborate with team members to improve our development infrastructure; developing, maintaining and extending the tools that our team relies on to do their work every day. Work with stakeholders to identify opportunities and establish requirements Identify solutions (3rd party evaluations, homegrown implementations), then adopt / develop / maintain your systems to meet all functional and technical requirements. Work with QA and technical leadership to ensure stability and robustness of your systems and production on scheduling and roll-outs. Support systems with documentation, training and debug tooling. Help grow your knowledge and that of those around you by collaborating with your peers via impromptu conversations, technical discussions and code reviews Be supportive of those around you and open to exploring, proposing or adopting new ideas, technologies and practices Qualifications Experience troubleshooting issues with users and communicating updates and resolutions to team members Experience supporting development teams, delivering and maintaining infrastructure-level systems optimized for developer up-time. Experience with Unreal Engine (Cloud DDC, GameSync, RoboMerge, Virtual Assets a plus) Extensive experience with source control (Perforce preferred) and integrations 5+ years of experience working with cloud service provider platforms (Azure preferred) Experience using NET, C#, and C++ and working with SQL and non-SQL databases Appreciation for robust, maintainable, easily readable code COMPENSATION AND BENEFITS The base salary ranges listed below are for the defined geographic market pay zones in these locations. If you reside outside of these locations, a recruiter will advise on the range and benefits for your specific location. EA has listed the base salary ranges it in good faith expects to pay applicants for this role in the locations listed, as of the time of this posting. Pay offered will be determined based on numerous relevant business and candidate factors including, for example, education, qualifications, certifications, experience, skills, geographic location, and business or organizational needs. BASE SALARY RANGES California (depending on location e.g. Los Angeles vs. Sacramento): º $149,150 - $233,500 USD Annually New York (depending on location e.g. Manhattan vs. Buffalo): º $136,000 - $233,500 USD Annually Jersey City, NJ : º $171,100 - $233,500 USD Annually Colorado (depending on location e.g. Denver vs. Colorado Springs): º $136,000 - $190,850 USD Annually Washington (depending on location e.g. Seattle vs. Spokane): º $136,000 - $218,900 USD Annually British Columbia (depending on location e.g. Vancouver vs. Victoria): º $114,050 - $185,250 CAN Annually Base salary is just one part of the overall compensation at EA. In the US, we offer a package of benefits including paid time off (3 weeks per year to start), 80 hours per year of sick time, 16 paid company holidays per year, 10 weeks paid time off to bond with baby, medical/dental/vision insurance, life insurance, disability insurance, and 401(k) to regular full-time employees. Certain roles may also be eligible for bonus and equity. For British Columbia, we offer a package of benefits including vacation (3 weeks per year to start), 10 days per year of sick time, paid top-up to EI/QPIP benefits up to 100% of base salary when you welcome a new child (12 weeks for maternity, and 4 weeks for parental/adoption leave), extended health/dental/vision coverage, life insurance, disability insurance, retirement plan to regular full-time employees. Certain roles may also be eligible for bonus and equity. We are a global team of creators, storytellers, technologists, experience originators, innovators and so much more. We believe amazing games and experiences start with teams as diverse as the players and communities we serve. At Electronic Arts, the only limit is your imagination."
https://www.indeed.com/viewjob?jk=9f87517b5d3cc056,indeed,Technical Program Manager,Amazon.com Services LLC,https://www.indeed.com/cmp/Amazon.com,"Seattle, WA, USA",fulltime,2023-11-28,yearly,119000,-1,USD,False,0,,,"5+ years of technical product or program management experience 7+ years of working directly with engineering teams experience 3+ years of software development experience 5+ years of technical program management working directly with software engineering teams experience Experience managing programs across cross functional teams, building processes and coordinating release schedules Come build the future as a Technical Program Manager III at Amazon, where you will be inspired working along-side best-in-class inventors and innovators! You will have the opportunity to create meaningful experiences that deliver on the ever-evolving needs of our customers, and your work will impact millions of people around the world. Apply now and you will be eligible for Amazon Technical Program Manager III positions that are based on your preferred location, team, tech stack, domain, language and more. We’re hiring across Amazon Stores in the United States and Canada. Teams with available positions including, but are not limited to: Consumer Technology: Build new generation features and products for amazon.com, constantly improving the Customer and Seller experience for billions around the globe. Whether building site wide features such as reviews and recommendations, category specific software for the likes of Pharmacy, Electronics, Digital Software and Video Games or seller infrastructure, there are a variety of complex problems to tackle using a range of technologies in the design of your technical solutions. Operations Technology: Shape the future of transportation planning and execution on a global scale, that impacts hundreds of fulfillment centers, thousands of Amazonians, and millions of customers across the world. Your technology will support thousands of operators worldwide to design, build and run the best-in-class Amazon transportation network. We are building intelligent software to make transportation more reliable, faster, and less costly, providing a better and less expensive experience for our customers. Financial Technology: Create next generation of distributed, scalable financial systems that support Amazon's current and future business needs. Use big data technologies to design and develop services that facilitate global financial transactions worth billions annually. You’ll lead architecture, design, implementation and deployment of large-scale critical and complex financial applications, owning all aspects of solutions end-to-end, through full stack software development. Human Resources Technology: Create a seamless experience for millions of Amazonians and/or candidates. Whether supporting technologies for onboarding, time and attendance, compensation, ama-zon.jobs, or recruiting, you’ll deliver robust feature sets, elegant designs, intuitive user interfaces and systems that make it easy for Amazonians to excel at performing critical business functions. Depending on your experience, Technical Program Manager III can typically expect to directly engage with developers and customers to address challenging problems, build software with the latest technologies and make da-ta-driven decisions to improve the customer experience. Your responsibilities extend to scaling systems by man-aging internal and external stakeholders across various domains, from business and operations to engineering, science, and deployment. As a Senior TPM, you will navigate bottlenecks, provide escalation management, make strategic tradeoffs, and balance business needs with technical constraints. The role also involves scoping and delivering large projects end-to-end, collecting requirements, writing specifications, and coordinating de-sign/implementation efforts. Ideally, you possess a strong program management background, demonstrated experience leading medium to large projects, and a well-rounded technical proficiency in current web technologies. About the team Here at Amazon, we embrace our differences. We are committed to furthering our culture of inclusion. We have ten employee-led affinity groups, reaching 40,000 employees in over 190 chapters globally. We have innovative benefit offerings, and host annual and ongoing learning experiences, including our Conversations on Race and Ethnicity (CORE) and AmazeCon (gender diversity) conferences. Amazon’s culture of inclusion is reinforced within our 14 Leadership Principles, which remind team members to seek diverse perspectives, learn and be curious, and earn trust. We are open to hiring candidates to work out of one of the following locations: Arlington, VA, USA | Bellevue, WA, USA | Los Angeles, CA, USA | Nashville, TN, USA | New York, NY, USA | Phoenix, AZ, USA | Seattle, WA, USA 5+ years of project management disciplines including scope, schedule, budget, quality, along with risk and critical path management experience Experience managing projects across cross functional teams, building sustainable processes and coordinating release schedules Experience defining KPI's/SLA's used to drive multi-million dollar businesses and reporting to senior leadership Oral and written English communication skills. Amazon is committed to a diverse and inclusive workplace. Amazon is an equal opportunity employer and does not discriminate on the basis of race, national origin, gender, gender identity, sexual orientation, protected veteran status, disability, age, or other legally protected status. For individuals with disabilities who would like to request an accommodation, please visit https://www.amazon.jobs/en/disability/us. Pursuant to the Los Angeles Fair Chance Ordinance, we will consider for employment qualified applicants with arrest and conviction records. Our compensation reflects the cost of labor across several US geographic markets. The base pay for this position ranges from $119,000/year in our lowest geographic market up to $231,400/year in our highest geographic market. Pay is based on a number of factors including market location and may vary depending on job-related knowledge, skills, and experience. Amazon is a total compensation company. Dependent on the position offered, equity, sign-on payments, and other forms of compensation may be provided as part of a total compensation package, in addition to a full range of medical, financial, and/or other benefits. For more information, please visit https://www.aboutamazon.com/workplace/employee-benefits. Applicants should apply via our internal or external career site."
https://www.indeed.com/viewjob?jk=36a116a613a7de47,indeed,Technical Program Manager,Amazon.com Services LLC,https://www.indeed.com/cmp/Amazon.com,"Seattle, WA, USA",fulltime,2023-11-27,yearly,119000,-1,USD,False,0,,,"5+ years of technical product or program management experience 7+ years of working directly with engineering teams experience 3+ years of software development experience 5+ years of technical program management working directly with software engineering teams experience Experience managing programs across cross functional teams, building processes and coordinating release schedules Come build the future as a Technical Program Manager III at Amazon, where you will be inspired working along-side best-in-class inventors and innovators! You will have the opportunity to create meaningful experiences that deliver on the ever-evolving needs of our customers, and your work will impact millions of people around the world. Apply now and you will be eligible for Amazon Technical Program Manager III positions that are based on your preferred location, team, tech stack, domain, language and more. We’re hiring across Amazon Stores in the United States and Canada. Teams with available positions including, but are not limited to: Consumer Technology: Build new generation features and products for amazon.com, constantly improving the Customer and Seller experience for billions around the globe. Whether building site wide features such as reviews and recommendations, category specific software for the likes of Pharmacy, Electronics, Digital Software and Video Games or seller infrastructure, there are a variety of complex problems to tackle using a range of technologies in the design of your technical solutions. Operations Technology: Shape the future of transportation planning and execution on a global scale, that impacts hundreds of fulfillment centers, thousands of Amazonians, and millions of customers across the world. Your technology will support thousands of operators worldwide to design, build and run the best-in-class Amazon transportation network. We are building intelligent software to make transportation more reliable, faster, and less costly, providing a better and less expensive experience for our customers. Financial Technology: Create next generation of distributed, scalable financial systems that support Amazon's current and future business needs. Use big data technologies to design and develop services that facilitate global financial transactions worth billions annually. You’ll lead architecture, design, implementation and deployment of large-scale critical and complex financial applications, owning all aspects of solutions end-to-end, through full stack software development. Human Resources Technology: Create a seamless experience for millions of Amazonians and/or candidates. Whether supporting technologies for onboarding, time and attendance, compensation, ama-zon.jobs, or recruiting, you’ll deliver robust feature sets, elegant designs, intuitive user interfaces and systems that make it easy for Amazonians to excel at performing critical business functions. Depending on your experience, Technical Program Manager III can typically expect to directly engage with developers and customers to address challenging problems, build software with the latest technologies and make da-ta-driven decisions to improve the customer experience. Your responsibilities extend to scaling systems by man-aging internal and external stakeholders across various domains, from business and operations to engineering, science, and deployment. As a Senior TPM, you will navigate bottlenecks, provide escalation management, make strategic tradeoffs, and balance business needs with technical constraints. The role also involves scoping and delivering large projects end-to-end, collecting requirements, writing specifications, and coordinating de-sign/implementation efforts. Ideally, you possess a strong program management background, demonstrated experience leading medium to large projects, and a well-rounded technical proficiency in current web technologies. About the team Here at Amazon, we embrace our differences. We are committed to furthering our culture of inclusion. We have ten employee-led affinity groups, reaching 40,000 employees in over 190 chapters globally. We have innovative benefit offerings, and host annual and ongoing learning experiences, including our Conversations on Race and Ethnicity (CORE) and AmazeCon (gender diversity) conferences. Amazon’s culture of inclusion is reinforced within our 14 Leadership Principles, which remind team members to seek diverse perspectives, learn and be curious, and earn trust. We are open to hiring candidates to work out of one of the following locations: Arlington, VA, USA | Bellevue, WA, USA | Los Angeles, CA, USA | Nashville, TN, USA | New York, NY, USA | Phoenix, AZ, USA | Seattle, WA, USA 5+ years of project management disciplines including scope, schedule, budget, quality, along with risk and critical path management experience Experience managing projects across cross functional teams, building sustainable processes and coordinating release schedules Experience defining KPI's/SLA's used to drive multi-million dollar businesses and reporting to senior leadership Oral and written English communication skills. Amazon is committed to a diverse and inclusive workplace. Amazon is an equal opportunity employer and does not discriminate on the basis of race, national origin, gender, gender identity, sexual orientation, protected veteran status, disability, age, or other legally protected status. For individuals with disabilities who would like to request an accommodation, please visit https://www.amazon.jobs/en/disability/us. Pursuant to the Los Angeles Fair Chance Ordinance, we will consider for employment qualified applicants with arrest and conviction records. Our compensation reflects the cost of labor across several US geographic markets. The base pay for this position ranges from $119,000/year in our lowest geographic market up to $231,400/year in our highest geographic market. Pay is based on a number of factors including market location and may vary depending on job-related knowledge, skills, and experience. Amazon is a total compensation company. Dependent on the position offered, equity, sign-on payments, and other forms of compensation may be provided as part of a total compensation package, in addition to a full range of medical, financial, and/or other benefits. For more information, please visit https://www.aboutamazon.com/workplace/employee-benefits. Applicants should apply via our internal or external career site."
https://www.indeed.com/viewjob?jk=54302f85fc3eed5a,indeed,Technical Program Manager,Amazon.com Services LLC,https://www.indeed.com/cmp/Amazon.com,"Seattle, WA, USA",fulltime,2023-11-28,yearly,119000,-1,USD,False,0,,,"5+ years of technical product or program management experience 7+ years of working directly with engineering teams experience 3+ years of software development experience 5+ years of technical program management working directly with software engineering teams experience Experience managing programs across cross functional teams, building processes and coordinating release schedules Come build the future as a Technical Program Manager III at Amazon, where you will be inspired working along-side best-in-class inventors and innovators! You will have the opportunity to create meaningful experiences that deliver on the ever-evolving needs of our customers, and your work will impact millions of people around the world. Apply now and you will be eligible for Amazon Technical Program Manager III positions that are based on your preferred location, team, tech stack, domain, language and more. We’re hiring across Amazon Stores in the United States and Canada. Teams with available positions including, but are not limited to: Consumer Technology: Build new generation features and products for amazon.com, constantly improving the Customer and Seller experience for billions around the globe. Whether building site wide features such as reviews and recommendations, category specific software for the likes of Pharmacy, Electronics, Digital Software and Video Games or seller infrastructure, there are a variety of complex problems to tackle using a range of technologies in the design of your technical solutions. Operations Technology: Shape the future of transportation planning and execution on a global scale, that impacts hundreds of fulfillment centers, thousands of Amazonians, and millions of customers across the world. Your technology will support thousands of operators worldwide to design, build and run the best-in-class Amazon transportation network. We are building intelligent software to make transportation more reliable, faster, and less costly, providing a better and less expensive experience for our customers. Financial Technology: Create next generation of distributed, scalable financial systems that support Amazon's current and future business needs. Use big data technologies to design and develop services that facilitate global financial transactions worth billions annually. You’ll lead architecture, design, implementation and deployment of large-scale critical and complex financial applications, owning all aspects of solutions end-to-end, through full stack software development. Human Resources Technology: Create a seamless experience for millions of Amazonians and/or candidates. Whether supporting technologies for onboarding, time and attendance, compensation, ama-zon.jobs, or recruiting, you’ll deliver robust feature sets, elegant designs, intuitive user interfaces and systems that make it easy for Amazonians to excel at performing critical business functions. Depending on your experience, Technical Program Manager III can typically expect to directly engage with developers and customers to address challenging problems, build software with the latest technologies and make da-ta-driven decisions to improve the customer experience. Your responsibilities extend to scaling systems by man-aging internal and external stakeholders across various domains, from business and operations to engineering, science, and deployment. As a Senior TPM, you will navigate bottlenecks, provide escalation management, make strategic tradeoffs, and balance business needs with technical constraints. The role also involves scoping and delivering large projects end-to-end, collecting requirements, writing specifications, and coordinating de-sign/implementation efforts. Ideally, you possess a strong program management background, demonstrated experience leading medium to large projects, and a well-rounded technical proficiency in current web technologies. About the team Here at Amazon, we embrace our differences. We are committed to furthering our culture of inclusion. We have ten employee-led affinity groups, reaching 40,000 employees in over 190 chapters globally. We have innovative benefit offerings, and host annual and ongoing learning experiences, including our Conversations on Race and Ethnicity (CORE) and AmazeCon (gender diversity) conferences. Amazon’s culture of inclusion is reinforced within our 14 Leadership Principles, which remind team members to seek diverse perspectives, learn and be curious, and earn trust. We are open to hiring candidates to work out of one of the following locations: Arlington, VA, USA | Bellevue, WA, USA | Los Angeles, CA, USA | Nashville, TN, USA | New York, NY, USA | Phoenix, AZ, USA | Seattle, WA, USA 5+ years of project management disciplines including scope, schedule, budget, quality, along with risk and critical path management experience Experience managing projects across cross functional teams, building sustainable processes and coordinating release schedules Experience defining KPI's/SLA's used to drive multi-million dollar businesses and reporting to senior leadership Oral and written English communication skills. Amazon is committed to a diverse and inclusive workplace. Amazon is an equal opportunity employer and does not discriminate on the basis of race, national origin, gender, gender identity, sexual orientation, protected veteran status, disability, age, or other legally protected status. For individuals with disabilities who would like to request an accommodation, please visit https://www.amazon.jobs/en/disability/us. Pursuant to the Los Angeles Fair Chance Ordinance, we will consider for employment qualified applicants with arrest and conviction records. Our compensation reflects the cost of labor across several US geographic markets. The base pay for this position ranges from $119,000/year in our lowest geographic market up to $231,400/year in our highest geographic market. Pay is based on a number of factors including market location and may vary depending on job-related knowledge, skills, and experience. Amazon is a total compensation company. Dependent on the position offered, equity, sign-on payments, and other forms of compensation may be provided as part of a total compensation package, in addition to a full range of medical, financial, and/or other benefits. For more information, please visit https://www.aboutamazon.com/workplace/employee-benefits. Applicants should apply via our internal or external career site."
