job_url,site,title,company,company_url,location,job_type,date_posted,interval,min_amount,max_amount,currency,is_remote,num_urgent_words,benefits,emails,description
https://www.indeed.com/viewjob?jk=356b294014066261,indeed,Modeling Engineer,NantWorks,https://www.indeed.com/cmp/Nantworks,"Culver City, CA, USA",fulltime,2023-11-30,yearly,140000,160000,USD,False,0,,,"NantWorks (the “Company”) is the parent company of various private and public entities that are changing how we work, live and play. We focus on three main categories: life sciences; energy & renewables; and media & technology. We invest in strategies that improve our core capabilities and in brand new industries, poised to change mankind for the better. By capturing tomorrow’s opportunities through scientific processes and entrepreneurial philosophies, we are at the forefront of emerging high-growth technologies across a wide range of industries. The Company is a mandatory vaccination employer for COVID-19 and its variants. The Company requires that its employees be fully vaccinated as of their start date. If you require a medical or religious accommodation we will engage in the interactive process with you. Proof of vaccination will be required prior to start. If we make you an offer and you are not yet vaccinated, we will accommodate a delay in start date. The Company may also mandate that its employees receive vaccine boosters, and all accommodation laws will be followed. At NantG Power, we believe that the future of renewable energy begins with YOU. NantG Power delivers battery technology breakthroughs that enable the world’s fastest growing industries including renewable energy storage, electrification of automobiles, aviation, and heavy equipment, consumer electronics and data centers among others. We are dedicated to intelligently identifying, developing, and deploying the most innovative technologies in order to leave the world a better place than we found it by using a combination of novel materials, designs, and approaches, along with world-class data analytics developed for solving another crucial challenge of tomorrow – cancer. We value talent, self-discipline, honesty, flexibility and friendliness, and treat all wins as team wins. Position Overview The R&D Cell Modeling Engineer will be responsible for developing physics- and data-driven model-based engineering approaches to improve our battery performance (kinetic performance, life degradation, calendar aging, electrochemical and thermal response, and safety-related behavior, etc.) and providing support for development of algorithms to effectively analyze large datasets. The R&D Cell Modeling Engineer will formulate, execute and own the experiments required to validate/train and further develop the models. This individual will be a key contributor in advancing NantG Power's competitive advantage to drive energy density, power density, safety, and materials sustainability improvements at scale. The ideal candidate will have a strong record of scientific achievement in the areas of Li-ion batteries, nanomaterials, and/or electrochemistry. Primary responsibilities Perform cell and module modeling in close collaboration with Battery R&D and Battery Testing teams Develop COMSOL/ANSYS multiphysics models of cells and modules Develop 1D mathematical models of electrochemical, transport, and other processes Develop algorithms to improve data analysis Maintain software licenses for modeling and data tools Stay current with state of the art in battery technology, model-based systems engineering practices and AI/data science methodologies/algorithms Produce regular technical reports to document models, validation, and other modeling initiatives Job Qualifications Master's or Ph.D. in Chemistry, Physics, Materials Science, Chemical Engineering, Mechanical Engineering, Electrical Engineering, Biomedical Engineering, or Industrial Engineering Minimum of 7 years of relevant experience, or advanced degree with a minimum of 5 years relevant experience Expertise in electrochemistry, lithium metal and lithium-ion batteries, preferably multiple chemistries, battery management systems, testing and formation protocols, and systems integration Experience developing physics-based (COMSOL/ANSYS) and data-driven models for electrochemical, electrical, thermal, and mechanical applications Skilled with Python and MATLAB for increasing data processing efficiency and quality Experience with database systems and querying for data using SQL or similar querying language Project management and leadership experience Strong team player Comfortable with initiating and taking ownership of projects Salary Range: $140,000 to $160,000 commensurate with education and experience. This is the pay range the Company reasonably expects to pay for this position at the time of this posting. Compensation will be determined based on the skills, qualifications, and experience of the applicant along with the requirements of the position. We offer competitive benefits, including health, dental and vision insurance, 401k, short-term and long-term disability insurance, life insurance, 11 designated holidays, Paid Time-Off program, and Employee Assistance Program."
https://www.indeed.com/viewjob?jk=8b47b39c699e76f0,indeed,Service Associate,BOEING,https://www.indeed.com/cmp/Boeing,"Seal Beach, CA, USA",,2023-12-01,yearly,81600,110400,USD,False,0,,,"At Boeing, we innovate and collaborate to make the world a better place. From the seabed to outer space, you can contribute to work that matters with a company where diversity, equity and inclusion are shared values. We’re committed to fostering an environment for every teammate that’s welcoming, respectful and inclusive, with great opportunity for professional growth. Find your future with us. The Boeing Company is looking for a Landing Gear Service Engineer – Systems (Wheels, Brakes, Tires, Extension-Retraction and Anti-Skid systems) to join the Landing Gear Service Engineering team in Seal Beach, CA. Landing Gear Service Engineers are an integral part of supporting all Boeing Commercial Airplane (BCA) models in-service and development, including programs such as 747, 767, 777, 787, 737NG, 737MAX, 777X, and the next generation of commercial airplanes. Our teams are currently hiring for a broad range of experience levels including; Associate, Mid-Level and Experienced Landing Gear Service Engineers. As part of your role, you will support service requests, customer solutions and predictive/proactive projects, for all in-service Boeing landing gear structures and systems. You will work directly with airline customers, Maintenance Repair Overhaul providers, and Suppliers to address and resolve any issues related to the in-service airplane system, related to Landing Gear structure and systems. You will act as a liaison and coordinate with various engineering and technical disciplines to address customer concerns. This position requires the flexibility to support emergent airline issues, requirements, and meetings. Occasionally, you may be required to work off-shift schedules to support the 24/7/365 fleet operation. Position Responsibilities: Develops creative and innovative solutions to customer issues with Landing Gear Rolling stock, braking systems and extension/retraction systems Provides system troubleshooting, fault isolation and root cause determination of landing gear system/component issues Works closely with Suppliers and Design Engineering to analyze reliability data and resolve system/component reliability issues Presents and addresses complex technical issues at airline customer, as well as, Supplier forums Analyzes flight and operational data to resolve landing systems issues Participates and/or leads component reliability improvement projects Assists with the development and documentation of basic requirements via drawings, data sets, reports, specifications, and supporting data Develops or modifies basic designs based on defined requirements Assists in monitoring suppliers' performance to ensure compliance with requirements Supports resolution of product integration issues and production anomalies Assists other members of project or program teams, management, and technical staff to define and implement engineering solutions to meet group, organization, and company objectives Responds to incoming customer service requests with development of robust and timely technical dispositions Supports the research of technical, operational and quality issues that cannot be resolved by the customer Supports review and development of technical documentation (e.g. Fleet Team Digest articles, service letters, drawings, specifications, documents, data sets, manuals) in accordance with engineering processes and procedures for internal reference or external delivery Assists in developing troubleshooting and/or repair procedures, as well as, providing analysis of interim and final engineering solutions to return airplanes to revenue service Works with cross-functional teams to conduct root cause analysis and develop dispositions for complex design non-conformances Participates in Customer on-site Aircraft-On-Ground (AOG) activities to restore aircraft to serviceable condition Leverages our Customer Support and larger Boeing networks to support customer needs This position is expected to be 100% onsite. The selected candidate will be required to work onsite in Seal Beach, CA. This position must meet export control compliance requirements. To meet export control compliance requirements, a “U.S. Person” as defined by 22 C.F.R. §120.15 is required. “U.S. Person” includes U.S. Citizen, lawful permanent resident, refugee, or asylee. Basic Qualifications (Required Skills/Experience): Bachelor, Master, or Doctorate of Science degree from an accredited course of study, in engineering, computer science, mathematics, physics, or chemistry (ABET is a preferred, although not required, accreditation standard). 1+ years of experience with Structural Liaison, Structural Design or Structural Analysis Experience with Landing Gear Experience in developing or using various aircraft maintenance documents to maintain airplanes Preferred Qualifications (Desired Skills/Experience): 5 or more years' related work experience or an equivalent combination of education and experience 10 or more years' related work experience or an equivalent combination of education and experience Experience in Landing Gear systems (Wheels/Brakes/Tire/Hydraulic actuation) design and system troubleshooting Airline Maintenance Operations experience Knowledge of Boeing Communication System Typical Education/Experience: (Level 2): Education/experience typically acquired through advanced technical education from an accredited course of study in engineering, computer science, mathematics, physics or chemistry (e.g. Bachelor) and typically 2 or more years' related work experience or an equivalent combination of technical education and experience (e.g. Master). In the USA, ABET accreditation is the preferred, although not required, accreditation standard. Applicable and appropriate educational/certification credentials from an accredited institution and/or equivalent experience is required. (Level 3): Education/experience typically acquired through advanced technical education from an accredited course of study in engineering, computer science, mathematics, physics or chemistry (e.g. Bachelor) and typically 5 or more years' related work experience or an equivalent combination of technical education and experience (e.g. PhD, Master+3 years' related work experience). In the USA, ABET accreditation is the preferred, although not required, accreditation standard. Applicable and appropriate educational/certification credentials from an accredited institution and/or equivalent experience is required. (Level 4): Education/experience typically acquired through advanced technical education from an accredited course of study in engineering, computer science, mathematics, physics or chemistry (e.g. Bachelor) and typically 9 or more years' related work experience or an equivalent combination of technical education and experience (e.g. PhD+4 years' related work experience, Master+7 years' related work experience). In the USA, ABET accreditation is the preferred, although not required, accreditation standard. Applicable and appropriate educational/certification credentials from an accredited institution and/or equivalent experience is required. Relocation: This position offers relocation based on candidate eligibility. Work Shift: This position is for 1st shift. Union: This is not a union represented position. Drug Free Workplace: Boeing is a Drug Free Workplace where post offer applicants and employees are subject to testing for marijuana, cocaine, opioids, amphetamines, PCP, and alcohol when criteria is met as outlined in our policies. At Boeing, we strive to deliver a Total Rewards package that will attract, engage and retain the top talent. Elements of the Total Rewards package include competitive base pay and variable compensation opportunities. The Boeing Company also provides eligible employees with an opportunity to enroll in a variety of benefit programs, generally including health insurance, flexible spending accounts, health savings accounts, retirement savings plans, life and disability insurance programs, and a number of programs that provide for both paid and unpaid time away from work. The specific programs and options available to any given employee may vary depending on eligibility factors such as geographic location, date of hire, and the applicability of collective bargaining agreements. Pay is based upon candidate experience and qualifications, as well as market and business considerations. Summary Pay Range for Associate (Level 2: $81,600 - $110,400 Summary Pay Range for Mid-Level (Level 3): $102,000 - $138,000 Summary Pay Range for Experienced (Level 4): $$124,100 - $167,900 Export Control Requirements: U.S. Government Export Control Status: This position must meet export control compliance requirements. To meet export control compliance requirements, a “U.S. Person” as defined by 22 C.F.R. §120.15 is required. “U.S. Person” includes U.S. Citizen, lawful permanent resident, refugee, or asylee. Export Control Details: US based job, US Person required Equal Opportunity Employer: Boeing is an Equal Opportunity Employer. Employment decisions are made without regard to race, color, religion, national origin, gender, sexual orientation, gender identity, age, physical or mental disability, genetic factors, military/veteran status or other characteristics protected by law."
https://www.indeed.com/viewjob?jk=634e71fc8eadc774,indeed,Systems Analyst,"California State University, Fullerton",https://www.indeed.com/cmp/California-State-University-Fullerton,"Fullerton, CA, USA",fulltime,2023-12-01,monthly,6686,12947,USD,False,0,,,"JOB 531841 - Linux System Operating Analyst (Operating Systems Analyst Expert) Classificaiton: Operating Systems Analyst – Expert Department: College Centralized Information Technology Sub-Division: Information Technology Salary Range: Classification Range $6,686 - $12,947 per month(Hiring range depending on qualifications, not anticipated to exceed $6,686 - $9,000 per month) Appointment Type: Temporary Time Base: Full Time Work Schedule: Monday – Friday, 8:00 AM – 5:00 PM; occasional early morning, evening and/or weekend hours. This is a temporary position to end on or before June 30, 2024 with a possibility of renewal on an annual basis if funds and/or program needs exist. About CSUF: Standing on 241 acres at the heart of Southern California, the university was founded in 1957 and has grown into a population of over 39,000 students. As Titans, we believe that diverse perspectives deepen our understanding. We are committed to giving students the support they need to graduate, while responding to California’s revolving work force needs. At California State University, Fullerton we strive for continual improvement of students, staff, faculty and administrators through orientations, training programs and professional development opportunities. As part of the Titan Community, you have access to many campus facilities and services including but not limited to the Grand Central Art Center in Santa Ana, Fullerton Arboretum, cultural events and performances in the Clayes Performing Arts Center, Cal State Fullerton Athletics sports events, Titan Recreation Center, and the Employee Wellness Program. Job Summary: It is an exciting time to join Cal State Fullerton as we are an in demand comprehensive University that is driven to shape the future of education and foster a vibrant community of diverse students, faculty, staff and administrators who uphold values of inclusive excellence, free speech, and an environment free from discrimination. We are continuously seeking individuals from a variety of career disciplines that share in the University's mission and core values. We warmly welcome you to consider joining the Titan Community where minds expand and opportunities flourish. About the Position: The Division of Information Technology (IT) strives to be a strategic, innovative and best‐in‐class IT organization that provides a leading‐edge technology environment for students, faculty and staff to advance the University's mission, vision and goals. We are seeking an exceptional individual to join our College Centralized team as the Linux System Operating Analyst (Operating Systems Analyst - Expert). The ideal candidate in this role should have a positive attitude and an active, energetic mind that is characterized by highly ethical practices and a commitment to diversity, openness, flexibility, integrity, and kindness. Under general supervision, the Linux System Operating Analyst (Operating Systems Analyst - Expert) provides technical support, including but not limited to, Linux/Windows server administration, operational maintenance and project implementation. Supports Unix based operating systems and associated open-source software. Evaluates, creates and maintains automation files used to configure systems and services. Responsible for the maintenance, configuration, and reliable operation of computer systems, physical servers, and virtualization, including cloud instances. Maintains lab and classroom equipment. Provides technical support to faculty, staff and students. Must have extensive experience working with systems in Linux / open-source environment; Extensive experience installing, configuring, integrating and supporting Linux servers, systems analysis, and/or systems-level programming in a distributed network environment. Knowledge of Windows/Mac operating systems and applications. Knowledge of operating systems and storage capacity, including ability to perform capacity planning. Knowledge of virtualization, VMWare, or equivalent. Independently identifies and implements critical maintenance fixes and isolates and corrects malfunctions, including interface problems. Independently applies technical judgment and troubleshoots skills to respond to hardware and software problems. Engages in multiple tasks and projects under competing deadlines and maintains flexibility in response to shifting priorities. Excellent written and oral communication skills. Excellent customer service skills with the ability to communicate technical knowledge to functional units. Performs other duties as assigned. Essential Qualifications: Bachelor’s degree from an accredited four-year college or university in Computer Science, Computer Information Systems, Information Systems, Engineering or a related field and five years of relevant full-time experience. Twelve years of relevant full-time experience may be substituted for the previously listed education and experience requirement. Advanced knowledge of the work area demonstrated by an understanding and use of advanced principles and theories. Ability to integrate and apply work related knowledge to achieve innovative solutions. Ability to anticipate the impact of problems and solutions on other systems. Ability to investigate and research new systems and technologies. Ability to develop complex information technology systems and solutions. Ability to understand problems from a broad perspective and explore, conceive, and implement solutions and ideas in new ways. Ability to predict and anticipate problems and create proactive solutions. Demonstrated communication expertise using persuasion and negotiation. Ability to lead technical team efforts, assess skills within a team, and build individual strengths to maximize team results. Ability to teach and transfer knowledge and skills to others. A background check (including a criminal records check) must be completed satisfactorily and is required for employment. CSU will make a conditional offer of employment, which may be rescinded if the background check reveals disqualifying information, and/or it is discovered that the candidate knowingly withheld or falsified information. Failure to satisfactorily complete the background check may affect the continued employment of a current CSU employee who was conditionally offered the position. Preferred Qualifications: Experience offering help desk support and end-user hardware and software support and maintenance. Experience in computer programming, troubleshooting and repair. Experience supporting Windows servers. Familiarity with Active Directory, Office 365, Azure, AWS. Experience with cloud infrastructure deployment. Strong knowledge of systems and networking software, hardware, and networking protocols. Ability to develop and execute disaster recovery plans. Special Working Conditions: https://nam01.safelinks.protection.outlook.com/?url=http%3A%2F%2Fwww.fullerton.edu%2Ftitleix%2Fabout%2Fnotice.php&data=02%7C01%7Cjestorres%40Fullerton.edu%7C15ed352531714618408508d8485d17bc%7C82c0b871335f4b5c9ed0a4a23565a79b%7C0%7C0%7C637338911951373901&sdata=xvyd9bV1BBgkL8K3puf0b2bbrfRGvMAbW81ccHB%2FMh4%3D&reserved=0 Additional Information: California State University, Fullerton celebrates all forms of diversity and is deeply committed to fostering an inclusive environment within which students, staff, administrators and faculty thrive. Individuals interested in advancing the University’s strategic diversity goals are strongly encouraged to apply. Reasonable accommodations will be provided for qualified applicants with disabilities who self-disclose. As of January 1, 2022, the https://calstate.policystat.com/policy/10899725/latest/ prohibits the hiring of employees to perform CSU-related work outside the state of California. The person holding this position is considered a mandated reporter under the California Child Abuse and Neglect Reporting act and is required to comply with the requirement set forth in CSU Executive Order 1083, revised July 21, 2017. Multiple positions may be hired from this recruitment based on the strength of the applicant pool. If you are applying for a staff position, please note that you are not eligible to work concurrently in a staff position and an Academic Student position such as Graduate Assistant, Teaching Associate, Instructional Student Assistant or a Student Assistant position. Regular attendance is considered an essential job function; the inability to meet attendance requirements may preclude the employee from retaining employment. Employee/applicant who submits an application for a position may be required to successfully complete job related performance test(s) as part of the selection process. Online application/resume must be received by electronic submission on the final filing date by 9:00 PM (Pacific Standard Time)/midnight (Eastern Standard Time). Applicants who fail to complete all sections of the online application form will be disqualified from consideration. California State University, Fullerton is not a sponsoring agency for staff or management positions (i.e. H1-B Visas). Application Deadline: Dec 07, 2023 (9:00 PM) Apply online at: https://apptrkr.com/4832748 Copyright ©2022 Jobelephant.com Inc. All rights reserved. https://www.jobelephant.com/ jeid-9b6e92aab590b54695b1a4b744fa2770"
