job_url,site,title,company,company_url,location,job_type,date_posted,interval,min_amount,max_amount,currency,is_remote,num_urgent_words,benefits,emails,description
https://www.ziprecruiter.com/k/l/AAKRtmF7DjNznH5Xdelol33-CCBAt9Yi-8oU3VQMOlh8eo-3XDNcqn2cYMy066H7cYjvB-wTa-kPIE5CMb1OefyquOtvq_6xJ4r5Y5AQjlELWCy3Qlpu5rM4XfG_qitHjeht9cAzikUOHrfQAl5JC2VoneeEzepqxq4WBykh0tAbAKcYRfC4KbrYDTs-lfP6aq2_u4r3zhTdNTl-pSZjrFnB0ANxdJ8bqyqSSg,zip_recruiter,Network Systems Engineer,MERIT Solutions,,"Chesapeake, VA, USA",fulltime,2023-12-04,yearly,80000,100000,USD,,0,,,"JOB DESCRIPTIONJob Title: Network Systems Technician, Level 3Department: Reports to: Manager of OperationsGENERAL SUMMARY:The Level 3 Network Systems Technician is responsible for providing high-level technical assistance to the help desk team. This position is responsible for third level support of service requests, including escalation of level 1 and level 2 service tickets, technology, and duties, plus advanced technical issues. The Level 3 Network Systems Technician also acts as a technical resource to the TAM and CEM teams.Duties and Responsibilities:· Troubleshoot and resolve issues related to technical difficulties with hardware, software and network via telephony, email, ticket portal or in person· Responsible for mentoring and assisting with level 1 and level 2 escalations· Drive problem investigation and resolution as required· Contribute to the continuity of computer services by providing the necessary technical leadership· Identify areas for improvement and make constructive suggestions for change· Develop training programs to develop and refine the skills of the help desk team· Write service templates, as well as Run Books, to contribute to the knowledge base· Document internal processes and procedures related to duties and responsibilities· Work with the Manager of Operations and the Help Desk Supervisor on strategic initiatives leading towards more effective methods and process with a focus on resolution times.· Assist the CEM and TAM with design and development tasks when requested· Review IT publications and online materials to remain up to date with current and future technologies emerging in the industry· Remain up to date with all certifications to ensure Best Practices are being followed.Competencies:· 5+ years of experience working on a technical support help desk· Technical writing skills with focus on training and documentation· Diagnosis skills of technical issues· Ability to positively mentor, coach and lead by example· Proactively provide first class service· Conduct one’s self with proper business ethics; treat others with respect and keep commitments· Respond promptly and professionally with prospects, customers and fellow team members· Write clearly, informatively, and completely on all tickets and customer communications· Speak clearly and persuasively. Listen and probe openly and patiently and get clarification· Ability to handle and problem solve issues without direction· Must be able to be flexible with regards to schedule· Ability to complete multiple simultaneous projects in a timely manor· Have a high level of integrity and morale· Be presentable at all times as you represent Onepath at all timesKnowledge, Skills, and/or Abilities Required: To perform this job successfully, an individual must be able to perform each essential duty satisfactorily. The requirements listed below are representative of the knowledge, skill, and/or ability required. Reasonable accommodations may be made to enable individuals with disabilities to perform the essential functions.· 5+ years working on a professional help desk team with at least 2 years in a level 2 position· Professional IT Certifications, such as: Microsoft MCSE, Cisco CCNP, and/or MVWare VCP· Advanced understanding of operating systems, business applications, networking, printing systems, phone systems, and active directory.· Advanced Knowledge of LAN/WAN configurations and topologies· Familiarity with troubleshooting networking equipment and TCP/IP· Outside the box diagnosis skills of technical issues· Ability to multi-task and adapt to changes quickly· Attention to detail· Technical awareness: ability to match resources to technical issues appropriately· Service awareness of all organization’s key IT services for which support is being provided· Understanding of support tools, techniques, and how technology is used to provide IT service· Ability to work alone with minimal supervision as well as in a dynamic team environment· Self-motivated with the ability to work in a fast moving, sometimes high stress environment· Leadership skills with a sense of responsibility towards mentoring peersPreferred Qualifications:Minimum Bachelors Degree3+ Years in a Sales, Customer Service or BSA role supporting technologyWorking knowledge of Network FundamentalsExceptional presentation skillsStrong attention to detail and accuracyTechno-Functional or Business Systems Analysis SkillsExcellent documentation and proposal writing abilitiesBenefits:1. Salary is competitive with the Industry and commensurate with experience.2. Health insurance, Dental Insurance, Short Term Disability and Long Term Disability coverage following the completion of 90 days of employment.3. 401(k) pension plan, subject to plan terms (1 year vesting followed by enrollment on the closer of January 1 or July 1 of the corresponding year).4. 9 Company-paid holidays, including New Year’s Day, Memorial Day, Independence Day, Columbus Day, Thanksgiving Day, Friday after Thanksgiving, and Christmas Day.After your start date you will receive a Benefits Summary that provides detailed information concerning our total compensation program in effect as of your expected start date.Company Overview:MERIT (MERIT ) was founded in 1982 to be the Single-Source IT Communications Partner for businesses in Hampton Roads. MERIT manages computer systems and networks, provides VOIP Phone Systems, high speed internet connections, and is one of the highest ranked, independent MSPs in Virginia. We have a commitment to extraordinary service, which we believe is essential to achieve long term success. With over 100 years of combined experience in telecommunications, internet, wireless and information technology, MERIT ’s leadership team has built a dynamic company that emphasizes people and service as the foundations for long-term business success. With headquarters in Chesapeake, VA MERIT is a privately held company serving over 120 business clients.Job Type: Full-timeSalary: $80,000.00 - $100,000.00 per yearBenefits: Flexible scheduleHealth insurancePaid time off Schedule: Day shiftMonday to Friday Work Location: In person"
https://www.ziprecruiter.com/k/l/AAIYI-cOeVRZtsgLfUIjK1j0NTsUX8M8dpP2tYIwv_BLbFQmOzY4fvVwR8FFPt9gbsrUcMiGVra5u-1388FwBKp0eJBkqDbkiAkjKc-zA3dkvbLCEWWKDOask96J0kNHII2Y7cVhkZEuExDUXBzORzRHntKdtGjg0rfz8y_k7xBquti5QzV7idn9CWQbG_6kJPJ-Z0mbG1O0mQgonuoClw,zip_recruiter,"#2341 Associate Systems Engineer (SE20) CEC Virginia Beach, VA","ADVANTEDGE TECHNOLOGY, INC.",,"Virginia Beach, VA, USA",,2023-12-04,yearly,74697,78000,USD,,0,,,"Role and Responsibilities: Full Time position supporting the CEC Task Order filling the associate systems engineer position with extensive travel. Duties include: system engineering, test analysis ..."
https://www.ziprecruiter.com/k/l/AAJspH73sJh5Yx25d1gOOjX8G63IfBV7jDF0K_VZ4khY-PrlwDUbnsx-5boRidY-Cz5fcIUN1E_uWp18m_AqH4tYSZfF9Hdo5NH0eDrNedW2Hymil__vdjlB1kRp9t7PFADDEUIF6F2m2UPaR3hSK2M6soNuLldg6huQn0SrucPsNc2BviMJzpyMgrYgGxy5_zxPmsKeKJObpoUbHIAiTfhgzxYr-bkxqOjSDw,zip_recruiter,PE Sr. Electrical Engineer/Project Manager,"Electronic Systems, Inc. - A Xerox Company",,"Virginia Beach, VA, USA",fulltime,2023-12-04,yearly,110000,120000,USD,,0,,,"Our client, a well-known Engineering firm in Virginia Beach, VA specializing in mechanical, electrical, plumbing, technology and fire protection engineering services is seeking a Senior Electrical Engineer/Project Manager. In this role, the Senior Electrical Engineer/Project Manager will work closely with clients, team partners, and fellow staff to produce engineering drawings and documents. Responsibilities:Project and client management, overseeing of mechanical design execution.Prepare proposals for various clients as either the lead A/E or sub-consultant.Administer project contracts, including invoicing and resource management.Coordinates with company team leads for planning use of resources and completing projects within budgeted times. Supervise and mentor staff, and self-perform the following:Electrical system analysis, including normal and back-up power systems, lighting systems, and fire alarm systems.Preparation of construction documents for power distribution systems, lighting systems, and fire alarm system.Coordinate with in-house and subconsultant specialists for electrical support of varying low-voltage systems, such as technology, security, controls, etc.Coordinate with other trades, such as architects, mechanical and plumbing engineers and others for equipment power and control needs and sizing electrical distribution.Perform design calculations of electrical loads to size and select distribution equipment.Develop electrical systems one-line diagrams.Perform field verification of existing systems for renovation projects.Write and edit specifications to reflect the project requirements.Communication with manufacturer representatives to determine solutions for specific applications.Prepare design deliverables for various owner required submittals, i.e., SD, DD, CD level documents.Perform project construction administration including response to RFI’s, review of submittals, preparation of bulletins, review of contactor change orders, field visits and punch trips for installation verification.Review designs prepared by others as part of AEC’s QA/QC process.Attend meetings with clients, authorities having jurisdiction, and other professionals as projects require.Conduct business development activities, participating in various trade organizations, and preparing or assisting with presentations.Qualifications:10 - 15 years of electrical design and project management in consulting engineering.Working knowledge of design and analysis software such as Revit, AutoCAD, SKM, ETAP, Easypower.Good knowledge of National Electrical Code (NEC), State Energy Code, NFPA guidelines, and FGI guidelines.Experience with electrical system studies such as short circuit, over-current device coordination, and Arc Flash Hazard analysis per NPFA 70E.Ability to instruct staff in project communications, and client management.Proficient knowledge of standard construction practices and the ability to work with contractors to address construction issues.Ability to work and manage several project teams concurrently.Experience in designing Healthcare, Commercial, Public Sector, Education, and/or Institutional projects.Bachelor’s degree in Electrical Engineering Preferred.PE License preferred.RCDD preferred. Additional Experience/Skills Desired:Certifications for; Outside Plan Designer (OSP), Electronic Security Specialist (ESS), Certified Technology Specialist – Designer (CTS-D) a plus.High Performance & Sustainable Building Design Economic AnalysisCertified Commissioning Authority/Agent (CxA)Cost Estimating (MCACES, SUCCESS, TRACES and/or RS Means COSTWORKS)Design-Build project delivery methodVirginia Department of General Services (DGS), Division of Engineering & Buildings (DEB), Construction andProfessional Services Manual (CPSM) training and certification a plus.Our client offers competitive salaries with performance-based bonuses, career advancement opportunities, comprehensive health benefits, paid time off and holidays, and retirement saving options. The benefits package includes health (with FSA and HSA options), dental, vision, and life insurance. Retirement savings options include 401k with company match and ESOP contributions. Other benefits include tuition support, professional membership support, bonuses for publication and teaching, and more. AEC offers flexible work schedules and hybrid options to accommodate our employee's personal schedules and help with work/life balance."
https://www.ziprecruiter.com/k/l/AAL2Gjn217QbTsZkRBSlDYQPIMQh1LqUTDXdFLQUnVJEAn5D_Ols_hUCLN74wAZrzzdHBkEdrEVpvpm6Xl4eoLppz3-mo-eUJ9uoJFCfKCiRh6yYrUoSIKzzpvBJqu9JUEy5OH7BCYWDBlEzYPfBViEetYpjeuEwERDpLuHQrY4WH-qsH5RtQF2rcUM4ZYtBapc1puhLcwcL-4_vx0lhPCH2oHPdO-nRvgjN,zip_recruiter,FLUID POWER ENGINEER,Plasser American Corp,,"Chesapeake, VA, USA",,2023-12-04,,,,,,0,,,"Some see the railway as transportation, while at Plasser American we see it as transformation. The story of how steel tracks turned the American promise into American progress and forged a trusted pathway to the possibilities of the future. It’s a story that continues today, an American legacy unfolding mile by mile. There is a lot riding on those tracks and we know that support, quality and know-how are all important aspects in staying on track.That’s why the Plasser American tradition begins with a promise. A promise to do things right. An unapologetic commitment to quality that makes us the longtime trusted leader in cutting edge American made innovations for the North American railway. It’s a promise to see things differently to turn ordinary steel into safer passages. To be a partner that you can count on to engineer solutions for the challenges of today and for the opportunities of tomorrow. From research and design, expert manufacturing and delivering unapparelled services, our customers trust us to keep them ahead of the curve.Progress is about more than getting from Point A to Point B. It’s knowing you have a trusted foundation to move you forward toward new possibilities waiting around the corner. Join Plasser American to become part of our team forging ahead towards new opportunities in railway maintenance. The railway is a path to the future, choose this path and apply today.General Scope: Fluid Power Engineer to support Engineering group. Fluid power engineer applies fluid power theory and related knowledge to design, test and troubleshoot operational mobile hydraulic systems and applications.Position Summary:Applies knowledge of engineering principles to design products used on maintenance of way equipment for the railroad industry.Solid knowledge and understanding of fundamental and advanced Fluid power principles and ability to apply knowledge in the design of complex hydraulic/pneumatic circuits in an OEM environment.Complete fluid power systems experience with all levels of hydraulic/pneumatic components from pumps, motors, valves to actuators.Significant experience in mobile/construction equipment hydraulic/pneumatic system design, and development.Study, research and analyze customer specifications, manuals and other data to assist in creating machine work orders.Compiles and analyzes operational, test, and research data to establish performance standards for newly designed or modified equipment or product.Plans, schedules and coordinates the preparation of hydraulic/pneumatic projects to meet deadlines.Sizing and selecting hydraulic and pneumatic components and provide specifications to Planning/Purchasing department.Uses EPLAN Fluid for the automated design and documentation of circuits in fluid power installations in hydraulics, pneumatics, cooling and lubrication complying with current standards such as ISO 1219.Ability to systematically solve hydraulic/pneumatic related problems and perform root cause analysis.Supervise the detailed design and drafting of the hydraulic/pneumatic components and installation drawings with cad designers.Keeps informed of new methods and practices in system designs and components.Plans and develops experimental test programs.Analyzes test data and reports to determine if design meets functional and performance specifications.May require some traveling to customer job site to evaluate problems and report back to management with findings.Strong leadership and project management skills and self-starter.Good organizational skills, and ability to independently manage multiple and conflicting priorities.Ability to interact with various department and provide support to product line, purchasing, production, technical support and sales support.Education: As a minimum require a Bachelor's Degree in an engineering field with at least 5-7 years of experience in the field of mobile hydraulic design or a Master’s Degree with a minimum of 3-years of experience. Experience to consist of relevant product design or development of hydraulic components or motion control systems.Certified fluid power hydraulic specialist (CFPS), NFPA (National Fluid Power Association) or other fluid power organizations certificate is required.In addition to having the technical qualifications, a fluid power engineer must be a good team player with strong communication and problem-solving skills. The individual must be able to think practically and authoritatively, able to accommodate the company's deadlines, budget, and other resources to make informed decisions for their projects.Knowledge: Incumbent must have proficient knowledge in the following areas:Knowledge of Engineering.Skills: Incumbent must demonstrate or participate in internal/external training programs to obtain the following skills:Knowledge of the current ISO and ANSI (Y14) standards.Working knowledge of the metric system and geometric dimensioning and tolerance.Familiar with weldments, and machining operation.Ability to read, analyze, and interpret common scientific and technical journals, financial reports, and legal documents.Ability to respond to common inquiries or complaints from customers, regulatory agencies, or members of the business community.Ability to write articles for publication that conform to prescribed style and format.EIT certification will be considered as a PLUS.Motivated and self-starter with the ability to work under deadlines.Ability to apply mathematical concepts such as Calculus and modern Algebra.Ability to define problems, collect data, establish facts, and draw valid conclusions.Ability to interpret an extensive variety of technical instructions in mathematical or diagram form and deal with several abstract and concrete variables.AREMA, AAR, S.A.E. membership helpful but not required.  Applicable Technical Competencies: Incumbent must have working knowledge and demonstrated abilities utilizing mechanical knowledge: Specific applications combined with knowledge competencies are as follows: Rating Level: 1-5 (1= minimum 5= Maximum)ApplicationRequired Level of proficiencyPreferred Level of proficiencyAutodesk Vault Professional 20154 - Full Proficiency5 - Expert ProficiencyInventor Professional 20154 - Full Proficiency5 - Expert ProficiencyAutoCAD 20154 - Full Proficiency5 - Expert ProficiencyMicrosoft Outlook3 - Working Proficiency3 - Working ProficiencyDesign Review3 - Working Proficiency4 - Full ProficiencyMicrosoft Excel4 – Full Proficiency5 - Expert ProficiencyMicrosoft Word4 - Full Proficiency4 - Full ProficiencyJIRA & Confluence3 - Working Proficiency4 - Full ProficiencyE-PLAN3 - Working Proficiency4 - Full ProficiencyAutomation Studio4 - Full Proficiency5 - Expert ProficiencyPersonal Attributes: Incumbent must maintain strict confidentiality in performing the duties of a Fluid Power Engineer. The incumbent must also demonstrate the following personal attributes:Be honest and trustworthyBe respectfulPossess cultural awareness and sensitivityBe flexibleDemonstrate sound work ethicsBenefits:Accrue 80 Hours of Paid Time Off during your first year of employment10 Paid Holidays per year401(k) match of $0.50 for every $1.00 you contribute up to 6% of your salaryYou may receive a merit bonus after completion of the audit at the end of the fiscal yearTuition ReimbursementFree Short and Long Term Disability after 90 days of employmentFree Life Insurance – 2 times your annual salaryCompany EventsFree employee medical and dental coverage. – valued at $7,500.00About Plasser American: As part of the Plasser family brand, which is the largest Maintenance of Way equipment provider in the world, PAC is a rapidly growing provider of railway equipment in North America. Continuing for the next few years, PAC will continue to make significant investments in the North American Market including a new office building and a substantial addition to our manufacturing facility. PAC is making the needed investments to continue its growth trajectory for many years to come. The next several years will be an exciting time of transformation. We look to the future to enhance our team and achieve our goals.PI233352586"
https://www.ziprecruiter.com/k/l/AAIe88WHsZRHb85PhS9AQZ5e8cCF_xyVvUqEHhKTf7m7Jx_Lx__wYAyYYMMJRFHEjeBZ9qBWoYK18Tmu5aewwWZ9p4gr5iChw8h97NkyRVuPtp0_1JfXymwafp6BNGr9lxyxGydAgH9bU4rmM9HZbP4Z3J4-33RWfcc_bFcEwMfsoKqRUOGvdvF6HeiEn1Y6zvblfB1Zz2KF1V3psOFgk5MAGKn_w-a6fc8quA,zip_recruiter,Systems Administrator,Premier Group Recruitment,,"Norfolk, VA, USA",contract,2023-12-04,hourly,30,35,USD,,0,,,"Contract RoleNo C2CSecret Clearance RequiredThe Opportunity:We are seeking a highly skilled Engineer (Core Services) on behalf of our client. Responsibilities will include:Execute system administrator responsibilities for NU, NR, and NS CIS systems within the CSU AOR.Perform troubleshooting of server/client hardware and software, ensuring resolution of issues.Manage and update the VMware Virtual Environment.Analyze and implement Microsoft Active Directory changes to align with user and operational requirements.Review and update Microsoft & Linux policies for system optimization and security enhancement.Implement and test new software versions and patches.Utilize PowerShell commands and scripts for the automation of system administration tasks.Assist in fault resolution, documenting actions following Incident Management procedures.Develop and maintain Standard Operating Procedures for routine system administration tasks.Adhere to EMSEC and Cyber Security policies/standards.Provide regular status updates for assigned requests using ITSM Service Desk Software.Conduct follow-ups with users upon completion of requests prior to closure.Collaborate with other work sections within the Service Operations Branch to support mission requirements.Lead the ITIL Problem Management process, contributing to Incident Management, Change Management, and Continuous Service Improvement.Develop and maintain Disaster Response Plans (DRPs) for assigned systems, conducting regular testing and execution in line with the overarching CSU DRP.Ability to lift 25lbs unassisted. About You:Demonstrated experience in supporting core enterprise services, including:System Administration within a large computer network.Proficiency in Windows and Linux Operating Systems.Active Directory and Group Policy Management.Virtualization of servers and desktops.Familiarity with Storage Area Networks (SANs).Knowledge of Data Backup systems.Utilization of scripting for task automation.Experience with large-scale system management tools, such as SCCM (System Centre Configuration Manager).Proven experience in leading technical teams and effectively managing projects.Strong knowledge of advanced troubleshooting techniques.Competence and experience in ITIL Problem Management.NATO Secret Clearance"
