job_url,site,title,company,company_url,location,job_type,date_posted,interval,min_amount,max_amount,currency,is_remote,num_urgent_words,benefits,emails,description
https://www.indeed.com/viewjob?jk=8091ad5947f5057f,indeed,Network Engineer,Cosm,https://www.indeed.com/cmp/Cosm,"Los Angeles, CA, USA",fulltime,2023-12-03,,,,,False,0,,,"Cosm is a global technology company that brings experiences to life in immersive environments. We help our partners create spaces and content that blur the lines of real and virtual across three primary markets: Sports and Entertainment, Science and Education, and Parks and Attractions. Cosm was born from the fusion of some of the greatest innovators in the history of technology. Evans & Sutherland, Spitz, Inc., and Cosm Immersive combined forces to power the immersive experiences of the future as Cosm. Innovation is in our DNA. Summary: Cosm is looking for an experienced network engineer to help build a new global network and operations center from the ground up. You’ll be responsible for working with several different technology teams within Cosm to define and help create a network to support Cosm’s growing business in expanding the immersive entertainment experience. This is an amazing opportunity to join a new team that will be on the ground floor for a new venture and get to build something from scratch. Responsibilities Partner with Network Architect, internal teams, and vendors on deploying a new multi-site network infrastructure. Implement and iterate solution packages for new site buildouts. Assist with implementing strategic decisions made by the senior engineering team. Support network architecture modifications as instructed by the senior network engineer. Assist in documenting network configurations and operational procedures. Provide Tier 1 and 2 support for networks, escalating issues when necessary. Receive and provide training on troubleshooting procedures. Participate in network performance monitoring and report findings. Assist in maintaining and updating network equipment to the latest firmware. Support research on emerging methodologies to improve network efficiency. Experience: You have 5+ years of experience working in Network Management and Support Cisco Certified Network Professional (Routing/Switching/Wireless certs) Experience creating and monitoring firewall policies. Able to manage, update, and troubleshoot Routing/Switching/Wireless networks. Experience with Cisco, Palo Alto, Dell, Aruba, Meraki, and Arista Experience with Azure/GCP/AWS network design Experience with network security Experience with Infrastructure as Cloud methodology Experience with BGP routing protocol Experience with troubleshooting with ISPs Experience with supporting media and broadcast systems Experience with live entertainment operations Work Environment: Must be able to lift 35lbs Must be available for travel to remote sites for installation. Must be able to work during a live production, with loud noise levels, and busy environments. Must participate in taking shifts in a 24/7 operations support center. The annualized base salary range for this position in California is $80,000-$95,000. The base salary offered will factor in internal equity and may also vary depending on the candidate’s geographic region, job-related knowledge, skills, and relevant experience, among other factors. Cosm is an equal opportunity employer. We celebrate diversity and are committed to creating an inclusive environment for all employees."
https://www.indeed.com/viewjob?jk=028f0f07cf66637a,indeed,System Engineer,Northrop Grumman,https://www.indeed.com/cmp/Northrop-Grumman,"Redondo Beach, CA, USA",,2023-12-03,yearly,63800,241400,USD,False,0,,,"Requisition ID: R10140970 Category : Engineering Location : Redondo Beach, California, United States of America | Manhattan Beach, California, United States of America+ 1 more Citizenship required : United States Citizenship Clearance Type : None Telecommute : No- Teleworking not available for this position Shift : 1st Shift (United States of America) Travel Required : Yes, 10% of the Time Relocation Assistance : Relocation assistance may be available At Northrop Grumman, our employees have incredible opportunities to work on revolutionary systems that impact people's lives around the world today, and for generations to come. Our pioneering and inventive spirit has enabled us to be at the forefront of many technological advancements in our nation's history - from the first flight across the Atlantic Ocean, to stealth bombers, to landing on the moon. We look for people who have bold new ideas, courage and a pioneering spirit to join forces to invent the future, and have fun along the way. Our culture thrives on intellectual curiosity, cognitive diversity and bringing your whole self to work — and we have an insatiable drive to do what others think is impossible. Our employees are not only part of history, they're making history. Available positions include: Electrical Design & Integration Engineers [TS/SCI clearance required] Structural Design & Analysis Engineers (Stress Analysis) [TS/SCI clearance required] Mechanical Design, Integration, and Test Engineers [TS/SCI clearance required] Command and Telemetry Engineers [TS/SCI clearance required] Test Conductors [TS/SCI clearance required] Mechanical Ground Systems Test Engineers (MGSE) [TS/SCI clearance required] Material and Process Engineers (Metals / Composites / Additive Manufacturing / Electronics [PCB/PWB]) Electric Subsystems Engineers [TS/SCI clearance required] Industrial Engineers Vehicle Engineers [TS/SCI clearance required] Embedded Software Engineers & Leads [DoD Secret clearance required] Cryocooler Engineers [TS/SCI clearance referred] Manufacturing Engineers (Space Flight HW) Contamination Control Engineers [TS/SCI clearance required] Thermal Systems Engineers [TS/SCI clearance required] Cable & Harness Engineers [TS/SCI clearance required] Propulsion Engineers [TS/SCI clearance required] CNC Programmers & EDM Machinists Tool Cutters Candidates who do not possess an active clearance must be eligible, able and willing to obtain and maintain a Department of Defense Secret and/or Top Secret clearance with an SCI Access. **This position description does not represent a current opening but may be used to identify candidates with skills and experience for positions within Northrop Grumman that frequently become available. Candidates who express an interest may be considered for future positions at Northrop Grumman.** Salary Range: $63,800 - $241,400 Employees may be eligible for a discretionary bonus in addition to base pay. Annual bonuses are designed to reward individual contributions as well as allow employees to share in company results. Employees in Vice President or Director positions may be eligible for Long Term Incentives. In addition, Northrop Grumman provides a variety of benefits including health insurance coverage, life and disability insurance, savings plan, Company paid holidays and paid time off (PTO) for vacation and/or personal business. Northrop Grumman is committed to hiring and retaining a diverse workforce. We are proud to be an Equal Opportunity/Affirmative Action Employer, making decisions without regard to race, color, religion, creed, sex, sexual orientation, gender identity, marital status, national origin, age, veteran status, disability, or any other protected class. For our complete EEO/AA and Pay Transparency statement, please visit http://www.northropgrumman.com/EEO. U.S. Citizenship is required for most positions."
https://www.indeed.com/viewjob?jk=66cef019077c056e,indeed,Network Engineer,Disney,https://www.indeed.com/cmp/The-Walt-Disney-Company,"Burbank, CA, USA",fulltime,2023-11-30,yearly,102500,137500,USD,False,0,,,"Network Engineer Apply Later Job ID 10072192 Location Burbank, California, United States Business The Walt Disney Studios Date posted Dec. 01, 2023 Job Summary: From movie concept to film production, global film shoots to remote editorial artists. You will support the network that supports a studio whose content is legendary and transcends generations. We’re looking for passionate engineers who love everything tech and want to be a part of the teams that are critical to enabling a global film studio at an unimaginable scale. Doing things that no film studio has ever attempted, much less achieved. We are seeking a skilled Network Engineer to join our team. You will play a pivotal role in network deployments and the implementation of innovative solutions, including the installation and configuration of critical network equipment such as routers, switches, and firewalls. Your meticulous documentation will be essential for maintaining network integrity, encompassing the creation and upkeep of network diagrams, configuration files, and records of changes. In addition to these core functions, you will excel in troubleshooting network issues, swiftly identifying and resolving problems related to connectivity, outages, and performance bottlenecks. You will also take on secondary responsibilities, including the regular maintenance and updates of network devices to optimize performance and security. Collaborating closely with network equipment vendors and service providers, you will ensure the seamless operation of our network. Furthermore, you will apply software updates, patches, and fixes to address security vulnerabilities and enhance network performance. Your expertise will be valuable in maintaining a secure and high-performing network infrastructure. This position would be a great match if you are: A strong problem solver. You take deep pride in your work and view each new problem as an opportunity for success; you approach challenges creatively, but methodically Comfortable with ambiguity. You face change with a cool head and persevere even if you do not have all the details; you are comfortable moving between projects and facing the uncertain because risk and change motivates you to evolve and innovate Technically astute. You rapidly learn new skills, grasping complicated technical information that often leaves others lost whether it is product, industry, or hard tech knowledge, you absorb it quickly and are ready for more A collaborator. Ready to engage with other engineers and cross-functional teams inside multiple Disney Studios banners Adaptable and skilled at pivoting between tasks seamlessly; adept at swiftly shifting priorities and navigating through various projects, demonstrating a high level of flexibility and the capability to manage multiple responsibilities effectively. Required Qualifications: Minimum 5 years network engineering experience Working knowledge of routing protocols such as BGP, OSPF, or IS-IS Working knowledge of overlay technologies such as IPSec, VxLAN, MPLS, and Cloud deployments. Hands on experience configuring and troubleshooting routers/switches, firewalls, load balancers, and Wi-Fi solutions Strong understanding of traffic flow across complex network deployments; able to identify issues from a physical link through to application level Strong communication and documentation skills Ability to work under tight timelines and pressure The ability to take troubleshooting and diagnostics to a root cause in a methodical manner BS in Computer Science or related field or equivalent experience Preferred Qualifications: Experience with Juniper EX/QFX/MX/PTX, Palo Alto, Pulse Secure, F5, and Mist Wi-Fi Extensive routing protocol knowledge of BGP and IS-IS JNCIP, CCNP, or other Professional-level network certifications Experience building or maintaining logging and monitoring systems Scripting or automation skills in languages such as Python, Ansible, Ruby, Prolog, or Piet The hiring range for this position in California is $102,500 - $137,500 per year based on a 40 hour work week. The amount of hours scheduled per week may vary based on business needs. The base pay actually offered will take into account internal equity and also may vary depending on the candidate’s geographic region, job-related knowledge, skills, and experience among other factors. A bonus and/or long-term incentive units may be provided as part of the compensation package, in addition to the full range of medical, financial, and/or other benefits, dependent on the level and position offered."
https://www.indeed.com/viewjob?jk=71e92bc0a72bb30a,indeed,Senior Research Engineer,USC,https://www.indeed.com/cmp/University-of-Southern-California,"Marina del Rey, CA, USA",,2023-11-30,yearly,134477,154823,USD,False,0,,,"USC’s Information Sciences Institute (ISI) , a unit of the university’s Viterbi School of Engineering, is a world leader in the research and development of advanced artificial intelligence, information processing, computing, cybersecurity, and communications technologies. ISI’s 400 faculty, professional staff and graduate students carry out extraordinary information sciences research at three distinct locations - Marina Del Rey, CA; Arlington, VA; and Waltham, MA. *This position is located in Marina del Rey, CA. Hybrid and in-person work schedules are available.* The Computational Systems and Technology division at ISI is a leader in disrupting and advancing the fields of digital design, computer architecture and EDA tooling. As an applied research lab, our work spans the creation and maturation of ideas from academic conception to applied research prototypes. CST staff can be found: Researching and developing AI-enabled EDA tools for next generation systems, Developing full scale domain specific computational accelerators for emerging fields such as Fully Homomorphic Encryption and RF spectrum sharing, Performing experiments on the International Space Station, Utilizing ISI’s MOSIS service to fabricate novel computer architectures. Our success is based on investing in our staff through a culture centered on: Learning and idea generation, Accepting challenges, and Continual growth through contributing to, creating, and leading a research agenda. We seek a Senior Research Engineer I to join our team. JOB ACCOUNTABILITIES: Supports the technical needs of research projects by implementing solutions in one or more programming languages. Maintains currency with and applies best practices in design, implementation, and engineering. Independently implements solutions to targeted research systems issues and tools to support project goals. Reviews and provides feedback on technical implementation of others. Independently performs most research assignments with instructions as to the general results expected. Collaborates with senior researchers to translate domain-specific needs into implemented solutions. Applies extensive domain-specific knowledge, gained from independent research, to implement project solutions. Demonstrates significant domain expertise and technical contributions in several related research areas. Takes a leadership role within a team, working closely with supervisor(s) on technical progress and challenges. Provides formal supervision to more junior staff as a part of a larger team. Provides technical mentorship to others. May serve as sole contributor and provide informal oversight to projects they are not directly working on. Establishes best practices within and/or across projects. Summarizes progress for project reports. Participates in meetings with external collaborators and/or cross-group meetings about program-level direction. May serve as the primary representative for the team. Presents work to external audiences. Identifies and understands new technology required to support project goals via tutorials, reading research publications and/or attending appropriate conferences. Stays informed of new developments and technologies by reading journals and other pertinent publications and participating in professional meetings and workshops. Promotes an environment that fosters inclusive relationships and creates unbiased opportunities for contributions through ideas, words, and actions that uphold principles of the USC Code of Ethics. PREFERRED QUALIFICATIONS: Excellent ASIC development skills Secret security clearance The annual base salary range for this position is $134,477 - $154,823. When extending an offer of employment, the University of Southern California considers factors such as (but not limited to) the scope and responsibilities of the position, the candidate’s work experience, education/training, key skills, internal peer equity, federal, state and local laws, contractual stipulations, grant funding, as well as external market and organizational considerations. The University of Southern California values diversity and is committed to equal opportunity in employment. Minimum Education: Bachelor's degree Minimum Experience: 8 years Minimum Skills: Knowledge of one or more relevant programming languages (e.g., Python, C++, Goolang). Experience with Linux. Experience with Virtual LAN and/or Virtual Extensible LAN. Experience with Melanox Switches. Experience with SDN programming. Experience with Ansible, Bash and Nagios. Experience with Prometheus. Familiarity with and Simple Network Management Protocol. Experience with applicable IT protocols (e.g., Border Gateway Protocol, Secure Shell, Transport Layer Security). Experience with iptables and Network File System. Excellent written and oral communication skills."
https://www.indeed.com/viewjob?jk=669e32df88d5ce0d,indeed,System Engineer,Hermeus,,"Los Angeles, CA, USA",fulltime,2023-12-01,,,,,False,1,,,"Hermeus is a startup developing hypersonic aircraft to radically accelerate air travel. At Mach 5, more than twice the speed of the supersonic Concorde, passengers will be able to cross the Atlantic in 90 minutes. On the path to hypersonic passenger aircraft, Hermeus is partnering with government agencies including the US Air Force and NASA to develop a series of autonomous aircraft that derisk the technology and solve urgent national security challenges. These products provide the data and confidence necessary to certify, produce, operate, and maintain safe and comfortable commercial aircraft. Hypersonic aircraft have the potential to create trillions of dollars of new global economic growth per year, unlocking significant resources that can be utilized to solve the world’s greatest problems. We are seeking a highly skilled and experienced Fluid Systems Engineer to join our dynamic team and contribute to the development of the next generation of hypersonic vehicles. As a Senior Fluid Systems Engineer at Hermeus, you will play a pivotal role in designing, analyzing, and testing fluid systems for our hypersonic vehicles. You will collaborate closely with a multidisciplinary team of engineers to ensure the safe and efficient operation of our cutting-edge propulsion and thermal management systems. This position offers a unique opportunity to work on groundbreaking technology in a fast-paced and collaborative environment. Key Responsibilities: Lead the design and analysis of fluid systems, including propulsion, thermal management, and fluid components for hypersonic vehicles. Perform fluids system sizing analysis to determine basic system requirements Transform system requirements into hardware concepts and trade implementation and architecture options Conduct performance analyses, and optimization studies to ensure the efficiency and reliability of fluid systems. Perform experimental testing and validation of fluid system components and configurations. Coordinate and execute development, qualification, and acceptance testing of flight hardware. Participate in design reviews, risk assessments, and problem-solving sessions to ensure project success. Qualifications: Bachelor's degree in Mechanical Engineering, Aerospace Engineering, or a related field. 1+ years of experience in fluid systems engineering, hypersonic or supersonic systems or rocketry preferred. Knowledge of fluid dynamics, heat transfer, and mechanical design. Experience with fluid systems and fluid component design, analysis, and testing. Excellent problem-solving skills and the ability to work in a fast-paced, collaborative environment. Strong communication and leadership skills. #LI-Onsite We encourage you to apply even if you have skillsets and experience outside of our current needs as we're always open to connect and discuss future opportunities."
https://www.indeed.com/viewjob?jk=bbc5d433fdbe0c05,indeed,Network Engineer,The Walt Disney Studios,https://www.indeed.com/cmp/The-Walt-Disney-Studios,"Burbank, CA, USA",fulltime,2023-12-01,yearly,102500,137500,USD,False,0,,,"From movie concept to film production, global film shoots to remote editorial artists. You will support the network that supports a studio whose content is legendary and transcends generations. We’re looking for passionate engineers who love everything tech and want to be a part of the teams that are critical to enabling a global film studio at an unimaginable scale. Doing things that no film studio has ever attempted, much less achieved. We are seeking a skilled Network Engineer to join our team. You will play a pivotal role in network deployments and the implementation of innovative solutions, including the installation and configuration of critical network equipment such as routers, switches, and firewalls. Your meticulous documentation will be essential for maintaining network integrity, encompassing the creation and upkeep of network diagrams, configuration files, and records of changes. In addition to these core functions, you will excel in troubleshooting network issues, swiftly identifying and resolving problems related to connectivity, outages, and performance bottlenecks. You will also take on secondary responsibilities, including the regular maintenance and updates of network devices to optimize performance and security. Collaborating closely with network equipment vendors and service providers, you will ensure the seamless operation of our network. Furthermore, you will apply software updates, patches, and fixes to address security vulnerabilities and enhance network performance. Your expertise will be valuable in maintaining a secure and high-performing network infrastructure. This position would be a great match if you are: A strong problem solver. You take deep pride in your work and view each new problem as an opportunity for success; you approach challenges creatively, but methodically Comfortable with ambiguity. You face change with a cool head and persevere even if you do not have all the details; you are comfortable moving between projects and facing the uncertain because risk and change motivates you to evolve and innovate Technically astute. You rapidly learn new skills, grasping complicated technical information that often leaves others lost whether it is product, industry, or hard tech knowledge, you absorb it quickly and are ready for more A collaborator. Ready to engage with other engineers and cross-functional teams inside multiple Disney Studios banners Adaptable and skilled at pivoting between tasks seamlessly; adept at swiftly shifting priorities and navigating through various projects, demonstrating a high level of flexibility and the capability to manage multiple responsibilities effectively. Required Qualifications: Minimum 5 years network engineering experience Working knowledge of routing protocols such as BGP, OSPF, or IS-IS Working knowledge of overlay technologies such as IPSec, VxLAN, MPLS, and Cloud deployments. Hands on experience configuring and troubleshooting routers/switches, firewalls, load balancers, and Wi-Fi solutions Strong understanding of traffic flow across complex network deployments; able to identify issues from a physical link through to application level Strong communication and documentation skills Ability to work under tight timelines and pressure The ability to take troubleshooting and diagnostics to a root cause in a methodical manner BS in Computer Science or related field or equivalent experience Preferred Qualifications: Experience with Juniper EX/QFX/MX/PTX, Palo Alto, Pulse Secure, F5, and Mist Wi-Fi Extensive routing protocol knowledge of BGP and IS-IS JNCIP, CCNP, or other Professional-level network certifications Experience building or maintaining logging and monitoring systems Scripting or automation skills in languages such as Python, Ansible, Ruby, Prolog, or Piet The hiring range for this position in California is $102,500 - $137,500 per year based on a 40 hour work week. The amount of hours scheduled per week may vary based on business needs. The base pay actually offered will take into account internal equity and also may vary depending on the candidate’s geographic region, job-related knowledge, skills, and experience among other factors. A bonus and/or long-term incentive units may be provided as part of the compensation package, in addition to the full range of medical, financial, and/or other benefits, dependent on the level and position offered."
