job_url,site,title,company,company_url,location,job_type,date_posted,interval,min_amount,max_amount,currency,is_remote,num_urgent_words,benefits,emails,description
https://www.indeed.com/viewjob?jk=7b57c6d950a77397,indeed,System Engineer,Geologics Corporation,https://www.indeed.com/cmp/Geologics-Corporation,"Torrance, CA, USA",contract,2023-11-30,hourly,68,78,USD,False,0,,"Mbaldwin@geologics.com, mbaldwin@geologics.com","Principal or Sr. Principal Systems Onsite Location: Torrance, CA Required: US Citizenship No 1099, No third parties, no C2C, No Visas or Green Cards No exceptions (Sorry) W2 Hourly term Contract Only $68.00- $.78.80 per hour based on experience and benefits package TORRANCE CA - ONSITE ROLE We have an opening with a great client of ours and we are looking for a Principal or Sr. Principal Systems Engineer to work a position in TORRANCE CA. This is a 6 month contract with a possible extension. Required: US Citizenship and Residency, W2 hourly Contract Only, No 1099, No third parties, no C2C. No exceptions Hourly Pay Range: $68.00- $78.80/hr. D.O.E. with limited benefits A Systems Engineer in the Defense and Aerospace Industry plays a crucial role in the development, integration, and maintenance of complex systems and technologies used in defense and aerospace applications. Qualifications Required US Citizenship and Residency Bachelor's or master's degree in Engineering, preferably in a relevant field such as Aerospace Engineering, Electrical Engineering, or Systems Engineering. Advanced degrees or certifications may be preferred for senior or specialized positions. Strong understanding of systems engineering principles, methodologies, and best practices. Familiarity with defense and aerospace industry standards, regulations, and specifications. Knowledge of relevant technologies, such as avionics, sensors, communication systems, and software integration. Ability to analyze complex system requirements, identify potential issues or risks, and propose innovative solutions. Strong problem-solving and troubleshooting skills to address integration challenges and ensure system performance. Excellent verbal and written communication skills to effectively interact with multidisciplinary teams, stakeholders, and clients. Ability to present technical information in a clear and concise manner. Proficiency in project management principles and practices. Experience in planning and executing engineering projects within defined timelines and budgets. Familiarity with systems engineering tools and software used for requirements management, modeling and simulation, configuration management, and project documentation (e.g., DOORS, SysML, MATLAB, Simulink). Security Clearance: Depending on the specific defense and aerospace project, a security clearance may be required. This can include background checks and adherence to strict security protocols. Top Skills: Requirements Development: Verification Methodologies and definitions. System architecture development Interface Design and Control Documentation Subsystem Design Description Document: States, Modes, Use Cases, CONOPS design and documentation. Open System Design Failure Modes and Reliability Analysis: FMECA, Reliability and Maintainability Documentation Integration Efforts: Mutli-discipline integration, Software Hardware CSCI mapping, Mechanical/EE interfacing Customer interfacing: PDR/CDR/TRR preparation and presentation, Ensuring integration to the platform. Responsibilities System Design and Development: Collaborate with cross-functional teams to design and develop system architectures, subsystems, and components for defense and aerospace systems. This involves understanding and analyzing system requirements, conducting feasibility studies, and creating design specifications. System Integration: Coordinate and oversee the integration of various subsystems, components, and technologies to ensure proper functionality and interoperability. This includes conducting system testing, troubleshooting issues, and implementing corrective measures. Requirements Management: Define, document, and manage system requirements throughout the entire development lifecycle. This involves capturing stakeholder needs, analyzing and allocating requirements, and maintaining traceability between system elements. Risk Assessment and Mitigation: Identify potential risks and uncertainties associated with system design, integration, and operation. Develop and implement strategies to mitigate risks, ensure system safety, and enhance reliability. Technical Documentation: Prepare and maintain accurate and comprehensive technical documentation, including system specifications, design documents, test plans, and user manuals. Ensure compliance with industry standards and regulations. Collaboration and Communication: Work closely with interdisciplinary teams, including engineers, project managers, and stakeholders, to ensure effective communication, collaboration, and alignment of project goals and objectives. Participate in meetings, reviews, and presentations. Verification and Validation: Plan and execute verification and validation activities to ensure that the developed systems meet the specified requirements and performance metrics. This includes developing test procedures, conducting tests, analyzing results, and documenting findings. System Lifecycle Management: Support system lifecycle management activities, including system upgrades, configuration management, and maintenance planning. Monitor system performance, assess operational issues, and propose improvements or enhancements. Please respond to Meredith Baldwin with your interest level, recent copy of your resume and your availability for a call to Mbaldwin@geologics.com Rates listed are not a guarantee of salary/rate. Rate offered at time of hire will depend on many factors including education, experience, interview results and skill level GeoLogics is an Equal Opportunity/Affirmative Action Employer that is committed to hiring a diverse and talented workforce. EOE/Disability/Veteran Meredith Baldwin Recruiter (703) 891-6115 mbaldwin@geologics.com #CJ"
https://www.indeed.com/viewjob?jk=6985c30eaad7ff94,indeed,Senior System Engineer,Motive Companies,https://www.indeed.com/cmp/Motive-Companies,"Chatsworth, CA, USA",,2023-11-30,yearly,140000,180000,USD,False,0,,,"Primary Responsibilities: Responsible for Systems Engineering tasks, including: System requirements development and decomposition Requirements review and tracking Interface design Test planning, definition, development and qualification Systems analysis, verification and validation System modeling and simulation Systems close-out report Perform systems technical lead tasks providing guidance for: Design efforts Design reviews Drawing releases Organizing and tracking of system configuration and changes Coordination and development of the test programs including procedures, test equipment, and reporting. Successful candidate will have and be proficient with Microsoft Office tools. Prepare and present customer presentations, and participate in face to face customer discussions regarding complex technologies Develop technical solutions derived from technology building blocks Lead special Research & Development project activities or investigations within the Engineering discipline. Coordinate activities of engineers within the Engineering Department and Program Office Required Skills: Strong knowledge of embedded computing hardware, including PowerPC, Graphics, Comms and I/O and DSP applications Hands on development, test and analysis experience Diverse background in electronic circuit design for embedded computer system development Strong communication skills and team player Multi-task assignments in a small company environment Manage and prioritize multiple simultaneous activities Experience: BS and 10+ years of experience Experience with mil-spec programs Experience with space programs, processes and standards, a plus Education : BS in Engineering, Physics, Math. MS preferred Special Requirements: Must be a U.S. Citizen or authorized to work in the United States Compensation: $140k-$180k DOE IND123"
https://www.ziprecruiter.com/k/l/AALBiEgIVY_2TtHZ0l-MGHQauFT1K4D02hiNu2V5xXw8nO0ktA_d2ps-ve5vCAqoM5j1YbgNCsa7T2XoWJsYR8golezK0bon7unEJB6Wp1WVsDyyuvV5f89bNcXTmVUqteA9PUwAMHTpt_UXfiWs_j-fkpurCqr2GGft_ggi3g9DnLZomEK18EdGTDKvzkhbrgU2IUGKd0NCX8k5mLc0gVnNqLVyx-6Hpacr,zip_recruiter,Systems Engineer - Meet in person,DCG Recruitment - Client,,"Los Angeles, CA, USA",fulltime,2023-12-04,yearly,114000,148255,USD,,0,,,"We are currently seeking to hire a Systems Engineer - Meet In Person to become an integral part of our development team! You will design and test operating systems-level software and network distribution software.Responsibilities:Develop, implement and manage computing systems softwareResearch and update network distribution software for optimal performanceDesign embedded software to assist with system automationPerform routine software maintenanceDocument all programming tasks and proceduresTroubleshoot and resolve any code issuesQualifications:Previous experience in software development, computer programming, or other related fieldsKnowledge of Java, Python, or other programming languageFamiliarity with relational databases such as MySQL, Oracle, and SQL ServerDeadline and detail-orientedStrong analytical and critical thinking skills"
https://www.ziprecruiter.com/ek/l/AAIlv7fEqwq1zspXkm6xi8lpbBZ5KJNhITcgrFh58Y9l6nw7lBfDebK3AYYPegFj-5CggFnnIFRMhwLkg2HFzCPtdQlsz0rFeXFWNEH3nHjDEpt4Fl-esrCjQkRaVtL6Zwm3MB9RIgoyLmktGOUVij_VkcAS9jBLunf2xJeV-jkEDje4kd_r9xBVTA_2iW25gmg_Tw0YpZhFeS2Cks4UZsRIVtLL-4d_GXa7,zip_recruiter,"Space, Intelligence & Weapon Systems Engineer Levels (Entry, Associate, Mid-Level)",BOEING,,"Los Angeles, CA, USA",,2023-12-04,,,,,,0,,,"As a Boeing Space and Launch Systems Engineer, you will design, develop, and deliver state-of-the-art communication/payload systems for space-based applications for commercial, civil and/or national ..."
https://www.ziprecruiter.com/k/l/AALhx3Kktz6vkBFDCNiFvTRCrxB7FqBPQVYySJHld2NOu4BQBBDrYAXNBcxKQozrB_amFq60MMwqwFo2rv4tp_fo9rnGiahhXUIVP7VG2VOJQQDS77AfAhNZaOOOv-8Yg4cTXNCdV1FEqQfZ-lrEEiEhOTb1DQgR7qPRhysjU4dmvNwOCijbyCUIrDBDqEUZC7Z2QLG6KlkPGeZleXbl6Ktr8VirBeUFqA0oDw,zip_recruiter,"Staff Software Engineer, Machine Learning",ZipRecruiter,,"Santa Monica, CA, USA",fulltime,2023-12-04,yearly,180000,225000,USD,,0,,,"We offer a hybrid work environment. Most US-based positions can also be performed remotely (any exceptions will be noted in the Minimum Qualifications below.)Our Mission: To actively connect people to their next great opportunity. Who We Are: ZipRecruiter is a leading online employment marketplace. Powered by AI-driven smart matching technology, the company actively connects millions of all-sized businesses and job seekers through innovative mobile, web, and email services, as well as through partnerships with the best job boards on the web. ZipRecruiter has the #1 rated job search app on iOS & Android.Summary:With data such as a billion+ historical job postings, tens of millions of active job seekers interacting with our system, and hundreds of billions of impression and click events, there are incredible opportunities to use your skills to build new data-driven features. Working at ZipRecruiter, you will be helping literally millions of people find their dream job. We're working on problems like: given a training set of job postings, and known salaries, build a system that predicts salary for novel jobs.Of course, you know that while building models is fun, it's also just one step in the process; gathering training data, cleansing it, digging into it, extracting features from it, etc, is a huge part of the jobKey Focuses:Design, develop, and maintain advanced machine learning models and algorithms to solve complex business problemsLead complex machine learning projects that solve business challenges and add value to the broader ZipRecruiter BusinessDesign the overall architecture and infrastructure for machine learning systems, ensuring scalability, efficiency, and robustnessPush the boundaries of what's possible in machine learning in your organization, finding new and innovative ways to use AI to drive business valueProvide leadership and set tone for Machine Learning Engineers at ZipRecruiter leveraging industry best practices and innovationStay up-to-date with the latest developments in machine learning and AI, and drive adoption of new techniques and technologies as appropriateMinimum Qualifications:7+ year of professional software development experience with a deep focus in machine learningComprehensive knowledge and experience of machine learning algorithms, techniques, and best practicesExtensive experience in machine learning model design, data pipeline design, experimentation and validation design, system design, and/or architecture design.Preferred Qualifications:10+ year of professional software development experience with an expertise in machine learningBS/MS/PhD in Mathematics, Computer Science, Physics, related technical field or equivalent practical experienceExpert knowledge of machine learning algorithms (e.g., linear regression, SVM, decision trees, neural networks, clustering, etc.) and best practicesProfound knowledge of machine learning algorithms and frameworks, such as TensorFlow, PyTorch, or scikit-learnExtensive background of deep learning architectures and techniques, such as Convolutional Neural Networks (CNNs), Recurrent Neural Networks (RNNs), Long Short-Term Memory (LSTM), and Generative Adversarial Networks (GANs)Deeply versed in NLP techniques and tools, such as tokenization, stemming, lemmatization, sentiment analysis, and named entity recognition, and libraries like NLTK, SpaCy, or BERTAs part of our team you'll enjoy:Competitive compensationExceptional benefits packageFlexible Vacation & Paid Time OffEmployer-matched 401(k) plan #LI-RemoteThe US base salary range for this full-time position is $180,000-$225,000. Our salary ranges are determined by role, level, and location, and the range displayed on each job posting reflects the minimum and maximum target for new hire salaries for the position across all US locations. Within the range, individual pay is determined by work location, role-related knowledge and skills, depth of experience, relevant education or training, and additional role-related considerations.Depending on the position offered, equity, bonuses, commission, or other forms of compensation may also be provided as part of a total compensation package, in addition to a full range of medical, financial, and other benefits.ZipRecruiter is proud to be an equal opportunity employer and provides equal employment opportunities (EEO) to all employees and applicants without regard to race, color, religion, sex, national origin, age, disability, veteran status, sexual orientation, gender identity or genetics.Privacy Notice: For information about ZipRecruiter's collection and processing of job applicant personal data for this job, please see our Privacy Notice at: https://www.ziprecruiter.com/careers/job-applicant-privacy-notice"
https://www.ziprecruiter.com/k/l/AAIWVA_kN3sa1CtWO8olbQjs7rZ-PepAczG3ZMzuouZ7y7EbD80xR1DO-bKBV1n7CuIMxO3t5dvZX68u-C0iJJ_dMiLijiw948x8JUbNad5EmhjwG0svbcfd4IO9m5y8eZJQGwy9myl6BJOuXW9u9MDDp99hjRFw3BCavP3gUAzdE52Yu2yIehbIfCnlOtk8EpLrqLo4BWbIxw3MicDE6DT9vhW0H1Wcm5SYPw,zip_recruiter,"Software Engineer, Machine Learning",ZipRecruiter,,"Santa Monica, CA, USA",fulltime,2023-12-04,yearly,105000,145000,USD,,0,,,"We offer a hybrid work environment. Most US-based positions can also be performed remotely (any exceptions will be noted in the Minimum Qualifications below.)Our Mission: To actively connect people to their next great opportunity. Who We Are: ZipRecruiter is a leading online employment marketplace. Powered by AI-driven smart matching technology, the company actively connects millions of all-sized businesses and job seekers through innovative mobile, web, and email services, as well as through partnerships with the best job boards on the web. ZipRecruiter has the #1 rated job search app on iOS & Android.Summary:At ZipRecruiter, where a universe of data, brimming with over a billion archived job postings, tens of millions of dynamic job seekers, and countless impression and click events, there's plenty of opportunities for innovation. Here, your experience will be put to work crafting new, data-driven features that impact the lives of millions, connecting them to their dream jobs.We're tackling exciting challenges: imagine developing a system that can predict salaries for new job postings, using a training set of job postings and known salaries. But the fun doesn't stop at model-building. Our work involves an immersive dive into data - gathering, cleaning, analyzing, and extracting meaningful insights.Key Focuses:Design, develop, and maintain machine learning models and algorithms to solve complex business problemsIdentify patterns, trends, and anomalies in the data, and visualize insights using appropriate toolsPerform data cleaning, preprocessing, and feature engineering to prepare datasets for model developmentAssess the performance of machine learning models using appropriate metrics, validation techniques, and testing datasetsOptimize models by fine-tuning hyperparameters, feature selection, or employing regularization techniques to improve accuracy, performance, and scalabilityMinimum Qualifications:1+ year of professional software development experience with a focus in machine learningExpertise in machine learning algorithms, techniques, and best practicesComprehensive computer science fundamentals in coding, object-oriented programming, data structures, and algorithmsPreferred Qualifications:3+ year of professional software development experience with a focus in machine learningBS/MS/PhD in Mathematics, Computer Science, Physics, related technical field or equivalent practical experienceStrong knowledge of machine learning algorithms (e.g., linear regression, SVM, decision trees, neural networks, clustering, etc.) and best practicesExperience with machine learning algorithms and frameworks, such as TensorFlow, PyTorch, or scikit-learnKnowledge of deep learning architectures and techniques, such as Convolutional Neural Networks (CNNs), Recurrent Neural Networks (RNNs), Long Short-Term Memory (LSTM), and Generative Adversarial Networks (GANs)Familiarity with NLP techniques and tools, such as tokenization, stemming, lemmatization, sentiment analysis, and named entity recognition, and libraries like NLTK, SpaCy, or BERTAs part of our team you'll enjoy:Competitive compensationExceptional benefits packageFlexible Vacation & Paid Time OffEmployer-matched 401(k) plan #LI-RemoteThe US base salary range for this full-time position is $105,000 - $145,000. Our salary ranges are determined by role, level, and location, and the range displayed on each job posting reflects the minimum and maximum target for new hire salaries for the position across all US locations. Within the range, individual pay is determined by work location, role-related knowledge and skills, depth of experience, relevant education or training, and additional role-related considerations.Depending on the position offered, equity, bonuses, commission, or other forms of compensation may also be provided as part of a total compensation package, in addition to a full range of medical, financial, and other benefits.ZipRecruiter is proud to be an equal opportunity employer and provides equal employment opportunities (EEO) to all employees and applicants without regard to race, color, religion, sex, national origin, age, disability, veteran status, sexual orientation, gender identity or genetics.Privacy Notice: For information about ZipRecruiter's collection and processing of job applicant personal data for this job, please see our Privacy Notice at: https://www.ziprecruiter.com/careers/job-applicant-privacy-notice"
https://www.ziprecruiter.com/k/l/AAKnXZZNaXJXDkMrJCG0LYOANIswGH7kw6_GEfOEwlbMjqZXoLq6jK5MzCFhH3kH1QWbRt81Vz1_1nc5C525S47JpNwieRULr6wfZcJwBtfVvcIdVJsCOFJ-yRIhHcG4IkUB4SYq3yb5sgoI08dW5KxP2VC38u-pf-Dee8Xr3dpL0bnE3OH8mlZMALSozihzKToQLVIURY0Ha6VQm822W-M7fPvzR-qTWeP8,zip_recruiter,Systems Engineer Administrator,LH Global Consulting,,"Northridge, CA, USA",fulltime,2023-12-04,yearly,80000,90000,USD,,0,,,"Position Summary:Under general direction, as a top level contributor, independently designs client server architecture to include hardware platforms, client applications, server services, Operating Systems as applies to Regal LAN and Data Center infrastructure. Analyzes current enterprise and makes recommendations for server and storage capacity planning and performance tuning. Provides 3rd or 4th level support for client OS and server NOS. Evaluates tests and makes recommendations on new/upgrades to hardware, OS and applications and their impact on existing system configurations. Independently researches and resolves moderately to highly complex technical problems. Documents standards, implementation procedures, and troubleshooting processes. May act as project manager on one or more projects. A. Essential Duties and Responsibilities include the following:1. The Systems Engineer candidate plays a lead role in the Windows/Intel Systems Service Delivery Organization. 2. Provides specialized enterprise level project based support and management for the Windows and Intel environments. 3. Designs and implements Client and Server architecture to include hardware platforms, client applications, server services, Operating Systems, storage networks. 4. Analyzes current enterprise and makes recommendations for capacity planning, performance tuning and design issues. 5. Provides 3rd level support for client and server design, storage planning and operating systems. 6. This is a key position which requires the skills of an architect, project manager, and systems administrator as well as the patience and tact of a good customer service representative. 7. This position requires extensive collaboration with teammates, other Business units, IT management. 8. Must have good communication skills and enjoy working in a team environment. 9. All other duties as directed by management.B. Education and/or Experience:1. Design, develop, and articulate solutions based on a customer's strategic business or technical requirements.2. Collaborate with internal and external teams to ensure engineered solutions are aligned to company standards 3. Work closely with Project Managers and Program Managers in the design, development, and implementation of the technical content defined in the Statement of Work 4. Create project status reports and accurately track/manage project issues and risks 5. Maintain regular communication with management to update them on project status and critical fault resolution progress 6. Experience in design, implementation and maintenance of various backup solutions; hardware, virtual and file. Experiences with Veeam, CommVault, and NetBackup a plus. 7. Provide System Architecture strategy and roadmaps for Client/Server Implementations of various Microsoft, Citrix, and VMware based solutions 8. Strong Storage background to include custom configuration of Dell and NetApp systems. 9. Working with internal/external security and network departments; design and maintain System Security 10. Develop and implement business solutions using PowerShell, VBScripts, and GPO’s. 11. Independently researches and resolves highly complex server or storage technical problems 12. Enforce Windows Server administration standards, policies and guidelines and develop and implement them as the needs are identified and prioritized 13. Troubleshoot Window servers issues and escalate as required 14. Maintain continuously updated documentation of key applications in order to facilitate the support and improvement of the platform 15. Broad understanding of Windows Server 2008, and above. 16. Microsoft Exchange environments; on premise & hybrid. 17. Detailed knowledge on Microsoft Active Directory 18. Detailed knowledge of Microsoft SQL 2008 R2 and above 19. Detailed knowledge in Windows Client and Server Architecture 20. Windows 10, Windows 11 21. Working knowledge of Azure, AWS and Hybrid environments 22. 5+ years systems administration and troubleshooting experience 23. 2+ years Windows architecture experience in a multi-site company 24. Strong documentation skills including experience writing proposals and statements of work 25. Excellent verbal and presentation skills 26. Excellent troubleshooting and problem solving skills 27. BA or BS degree in Computer Sciences or equivalent work experience 28. Microsoft Certifications a plus (MCSE, MCTS, MCITP,MCSA,MCP)  "
