job_url,site,title,company,company_url,location,job_type,date_posted,interval,min_amount,max_amount,currency,is_remote,num_urgent_words,benefits,emails,description
"https://www.glassdoor.com/job-listing/senior-unified-communications-engineer-avaya-exp-req-optivor-technologies-llc-JV_KO0,52_KE53,77.htm?jl=1007867206230",glassdoor,Senior Unified Communications Engineer (Avaya exp req.),"Optivor Technologies, LLC",,United States,,2022-05-16,yearly,100000,150000,USD,False,,,,
"https://www.glassdoor.com/job-listing/wi-fi-and-networking-engineer-ii-telecommunications-technical-services-JV_KO0,32_KE33,70.htm?jl=1008904739071",glassdoor,Wi-Fi and Networking Engineer II,Telecommunications Technical Services,,United States,,2023-10-03,yearly,90000,90000,USD,False,,,,
"https://www.glassdoor.com/job-listing/senior-system-integration-engineer-c4isr-and-c5isr-horizon-global-partners-llc-JV_KO0,50_KE51,78.htm?jl=1008656311447",glassdoor,Senior System Integration Engineer C4iSR and C5iSR,Horizon Global Partners LLC,,United States,,2023-05-19,yearly,99000,150000,USD,False,,,,
"https://www.glassdoor.com/job-listing/lead-enterprise-applications-engineer-workday-integration-cox-enterprises-JV_KO0,57_KE58,73.htm?jl=1008935446881",glassdoor,Lead Enterprise Applications Engineer-Workday Integration,Cox Enterprises,,United States,,2023-10-19,yearly,105700,176100,USD,False,,,,
"https://www.glassdoor.com/job-listing/fire-protection-engineer-w-doe-dod-or-nuclear-exp-sec-llc-JV_KO0,49_KE50,57.htm?jl=1008937702628",glassdoor,"Fire Protection Engineer (w/DOE, DOD or Nuclear exp.)",SE&C LLC,,United States,,2023-10-20,hourly,55,110,USD,False,,,,
"https://www.glassdoor.com/job-listing/welding-engineer-sec-llc-JV_KO0,16_KE17,24.htm?jl=1008933344253",glassdoor,Welding Engineer,SE&C LLC,,United States,,2023-10-18,hourly,50,110,USD,False,,,,
"https://www.glassdoor.com/job-listing/network-engineer-iv-stars-ii-telecommunications-communication-engr-horizon-global-partners-llc-JV_KO0,66_KE67,94.htm?jl=1008713560547",glassdoor,Network Engineer IV/ Stars II Telecommunications & Communication Engr.,Horizon Global Partners LLC,,United States,,2023-06-20,,,,,False,,,,
"https://www.glassdoor.com/job-listing/network-engineer-ii-stars-ii-telecommunications-engineer-analyst-horizon-global-partners-llc-JV_KO0,64_KE65,92.htm?jl=1008713552795",glassdoor,Network Engineer II/ Stars II Telecommunications Engineer/Analyst,Horizon Global Partners LLC,,United States,,2023-06-20,,,,,False,,,,
"https://www.glassdoor.com/job-listing/engineer-i-ii-sr-huntington-ut-ffr-110281-pacificorp-JV_IC1128107_KO0,41_KE42,52.htm?jl=1008910671803",glassdoor,"Engineer (I, II, SR) Huntington, UT (FFR# 110281)",PacifiCorp,,"Huntington, UT",,2023-10-05,,,,,False,,,,
"https://www.glassdoor.com/job-listing/servicenow-software-developer-mid-senior-peraton-JV_KO0,40_KE41,48.htm?jl=1008960086623",glassdoor,ServiceNow Software Developer / Mid-Senior,Peraton,,United States,,2023-11-02,yearly,86000,138000,USD,False,,,,
https://www.indeed.com/viewjob?jk=f84684745e304ade,indeed,Engineering Manager,Northrop Grumman,https://www.indeed.com/cmp/Northrop-Grumman,"Northridge, CA, USA",,2023-12-03,yearly,165000,247600,USD,False,0,,,"Requisition ID: R10141053 Category : Engineering Location : Northridge, California, United States of America Citizenship required : United States Citizenship Clearance Type : Secret Telecommute : No- Teleworking not available for this position Shift : Days (United States of America) Travel Required : Yes, 10% of the Time Relocation Assistance : Relocation assistance may be available Positions Available : 1 At Northrop Grumman, our employees have incredible opportunities to work on revolutionary systems that impact people's lives around the world today, and for generations to come. Our pioneering and inventive spirit has enabled us to be at the forefront of many technological advancements in our nation's history - from the first flight across the Atlantic Ocean, to stealth bombers, to landing on the moon. We look for people who have bold new ideas, courage and a pioneering spirit to join forces to invent the future, and have fun along the way. Our culture thrives on intellectual curiosity, cognitive diversity and bringing your whole self to work — and we have an insatiable drive to do what others think is impossible. Our employees are not only part of history, they're making history. Northrop Grumman Defense Systems is currently seeking an Engineering Manager - Systems to join Advanced Weapons to develop complex, next generation, state of the art weapon systems. The Engineering Manager serves as the lead for all engineering support assigned to a program, providing communications to/from program management, manufacturing, operations, customers, and all engineering Integrated Product Teams (IPTs) that belong to that project. Role Description & Responsibilities: The Engineering Manager will support the program manager (PM) as follows: Be responsible, working with the Chief Engineer, for program technical quality and performance. Working with IPT leads to make sure program cost and schedule are on track. Coordinating with PM to help develop the program work breakdown structure, integrated master plan, and integrated master schedule. Be responsible for providing organization and guidance towards: engineering resources assigned to the program. the engineering environment, as specified by the needs of the engineering teams, to meet program objectives – labs, tools, resources (e.g. workstations) the Technical Review Plan (all engineering work products required on a program, typically captured in a SEMP or SWDP) Providing Configuration Management oversight. Providing product/subsystems design oversight. Managing the preparations, timeliness, and completion of subsystem and lower technical reviews prior to (internal or customer) PDR and CDR. Be the interface to subcontracts management. Collecting and providing required data for Sector program review reporting on engineering performance including metrics. Supporting the transition of the system to the Manufacturing Operations Working with engineering functional management to ensure that standardized tools and processes are utilized and applied, as applicable to contract scope. Tracking and managing program resources to ensure required engineering support is properly maintained, in accordance with program plans and WBS implementation, in conjunction with the PM team or any other sector requirements, to meet program needs. Ensuring that change management and scope management is controlled, communicated, and is consistent with contractual requirements. Basic Qualifications: Bachelor's degree in a STEM discipline (Science, Technology, Engineering or Math) with 14 years of related engineering experience; or a Master’s degree in STEM with 12 years of related engineering experience, or a PhD in STEM with 9 years of related engineering experience. Must have an active DoD Secret or higher clearance. Preferred Qualifications: Familiarity with the AARGM, SW2 and GP Redesign programs. Excellent oral, written, and interpersonal communication skills. Salary Range: $165,000 - $247,600 Employees may be eligible for a discretionary bonus in addition to base pay. Annual bonuses are designed to reward individual contributions as well as allow employees to share in company results. Employees in Vice President or Director positions may be eligible for Long Term Incentives. In addition, Northrop Grumman provides a variety of benefits including health insurance coverage, life and disability insurance, savings plan, Company paid holidays and paid time off (PTO) for vacation and/or personal business. Northrop Grumman is committed to hiring and retaining a diverse workforce. We are proud to be an Equal Opportunity/Affirmative Action Employer, making decisions without regard to race, color, religion, creed, sex, sexual orientation, gender identity, marital status, national origin, age, veteran status, disability, or any other protected class. For our complete EEO/AA and Pay Transparency statement, please visit http://www.northropgrumman.com/EEO. U.S. Citizenship is required for most positions."
https://www.indeed.com/viewjob?jk=448ecd87ecc82025,indeed,Senior System Engineer,SpaceX,https://www.indeed.com/cmp/Spacex,"Hawthorne, CA, USA",,2023-12-03,yearly,125000,175000,USD,False,0,,,"SpaceX was founded under the belief that a future where humanity is out exploring the stars is fundamentally more exciting than one where we are not. Today SpaceX is actively developing the technologies to make this possible, with the ultimate goal of enabling human life on Mars. SR. DRAGON LIFE SUPPORT SYSTEM ENGINEER As a Dragon Life Support Systems Engineer at SpaceX, you will have the opportunity to utilize your knowledge, experience, and creativity as the owner of a portion of Dragon's life support and thermal control systems. Our Life Support Systems team focuses on the Dragon spacecraft, and develops the necessary systems to allow Dragon to maintain and support life on board in addition to maintaining thermal conditioning of avionics, propulsion, structures, and mechanisms across the spacecraft. This is a challenging role that covers the full product life cycle from piece part and component manufacturing and testing, to vehicle and mission operations, through refurbishment and maintenance across multiple worksites. You will collaborate with various partners across production and manufacturing, space operations, launch operations, and flight and build reliability organizations. RESPONSIBILITIES: Own a portion of the life support and thermal control systems aboard the SpaceX Dragon space capsule, consisting of system level requirements and component hardware ownership Perform thermal, structural, and fluids analysis as part of the design process Perform CAD modeling and drafting for new hardware development Define acceptance testing and qualification requirements, perform development and qualification testing to prove out design, and formally document test results Support build and capsule refurbishment through troubleshooting build problems and work to simplify and streamline recurring work to enable a higher launch cadence with higher reliability and lower labor hours per mission Support mission operations by providing real-time input during flight, completing data reviews and monitoring system performance, and working with partners to simplify operation of systems BASIC QUALIFICATIONS: Bachelor's degree in an engineering discipline 5+ years of hands on experience driving the design and development of mechanical components or systems (internship and project team experience is applicable) PREFERRED SKILLS AND EXPERIENCE: Hands-on experience with fluid (liquid and/or gas) handling systems Experience using data acquisition equipment, as well as test instrumentation and control components: pressure transducers, thermocouples, resistance temperature detectors, etc. Experience with HVAC systems and air ducting Experience with NX or similar CAD software Experience with fluid system schematics and fluid component selection Experience with drafting and Geometric Dimensioning and Tolerance (GD&T) Experience with pressurized structures and/or lightweight aerospace structures Demonstrated ability to work independently and rapidly learn and apply technical concepts and processes Strong collaboration and communication skills, and ability to work well in an integrated collaborative environment across engineers, technicians and leadership ADDITIONAL REQUIREMENTS: Must be willing to work extended hours and weekends as needed Ability to pass Air Force background checks for Cape Canaveral and Vandenberg COMPENSATION AND BENEFITS: Pay range: Life Support Systems Engineer/Senior: $125,000.00 - $175,000.00/per year Your actual level and base salary will be determined on a case-by-case basis and may vary based on the following considerations: job-related knowledge and skills, education, and experience. Base salary is just one part of your total rewards package at SpaceX. You may also be eligible for long-term incentives, in the form of company stock, stock options, or long-term cash awards, as well as potential discretionary bonuses and the ability to purchase additional stock at a discount through an Employee Stock Purchase Plan. You will also receive access to comprehensive medical, vision, and dental coverage, access to a 401(k) retirement plan, short & long-term disability insurance, life insurance, paid parental leave, and various other discounts and perks. You may also accrue 3 weeks of paid vacation & will be eligible for 10 or more paid holidays per year. Exempt employees are eligible for 5 days of sick leave per year. ITAR REQUIREMENTS: To conform to U.S. Government export regulations, applicant must be a (i) U.S. citizen or national, (ii) U.S. lawful, permanent resident (aka green card holder), (iii) Refugee under 8 U.S.C. § 1157, or (iv) Asylee under 8 U.S.C. § 1158, or be eligible to obtain the required authorizations from the U.S. Department of State. Learn more about the ITAR here. SpaceX is an Equal Opportunity Employer; employment with SpaceX is governed on the basis of merit, competence and qualifications and will not be influenced in any manner by race, color, religion, gender, national origin/ethnicity, veteran status, disability status, age, sexual orientation, gender identity, marital status, mental or physical disability or any other legally protected status. Applicants wishing to view a copy of SpaceX's Affirmative Action Plan for veterans and individuals with disabilities, or applicants requiring reasonable accommodation to the application/interview process should notify the Human Resources Department at (310) 363-6000."
https://www.indeed.com/viewjob?jk=aa98438c78589a9d,indeed,Senior System Engineer,Relativity Space,https://www.indeed.com/cmp/Relativity-Space,"Long Beach, CA, USA",,2023-12-03,yearly,108000,138000,USD,False,0,,,"Company Overview: A rocket company at the core, Relativity Space is on a mission to become the next great commercial launch company. Meeting the needs of a growing demand for space infrastructure, our rockets will revolutionize how we connect and communicate on Earth by getting satellites to space. We have developed a vertically integrated technology platform in which we leverage additive manufacturing, artificial intelligence, and autonomous robotics to 3D print rockets. Our unique approach enables rapid product iteration, allowing us to push the boundaries of what's possible today and unlock the full potential of 3D printing for tomorrow. Join us on this extraordinary journey, as we work together to transform our vision into reality. Team: The Avionics team is responsible for the full lifecycle of all electronics and supporting hardware central to operating Relativity's rockets. The team designs, builds, tests, integrates, and operates the hardware which controls the rocket in flight, downlinks critical telemetry, keeps the public safe, and deploys our customers' payloads to orbit! Our hardware enables Relativity to reliably control our rockets while maintaining the flexibility to rapidly iterate our designs. As a member of this team, you will design innovative hardware solutions capable of surviving harsh launch and space environments. Your designs will support multiple vehicle systems such as sensors, propulsion, computing, actuation, energy management, and communications. What you’ll do: Relativity seeks a highly talented Avionics System Engineer to join the Avionics organization. This position will take a design from a prototype to a flight-ready system through a complex test and verification campaign. This role will own the certification, analysis, and testing of safety-critical avionics components, and work with internal teams, vendors, and regulatory agencies to ensure the system meets all requirements. Your main objectives in this role will be: Take avionics hardware from development-level maturity to a flight-ready system Work with government agencies to ensure compliance to all safety requirements Establish schedule and test plans to qualify all safety critical hardware/software Produce analyses to validate the system design This role is heavy in certification activities-attention to detail with clear and precise communication skills are crucial. What you need to know: An undergraduate or graduate degree (BS/MS/PhD) in a relevant engineering discipline (Electrical Engineering, Computer Engineering, Aerospace Engineering, etc.) Demonstrated capability manage a hardware/software project to completion. Experience designing, developing, and testing avionics or similar electrical hardware. Experience tailoring design and test requirements with government agencies. Ability to perform analysis to clearly demonstrate fault architecture meets requirements. Nice to have but not required: Prior work on a launch vehicle or space system Experience with USSF Range Safety and/or FAA launch vehicle license regulations Experience designing and testing hardware per common aerospace industry standards such as RCC-319, AFSPCMAN 91-710, MIL-STD-810, SMC-S-016, MIL-STD-461 Experience with failure analysis and anomaly resolution Relativity Space offers competitive salary and equity, a generous vacation policy, an annual L&D stipend and more! We are an equal opportunity employer and value diversity at our company. We do not discriminate on the basis of race, religion, color, national origin, gender, sexual orientation, age, marital status, veteran status, or disability status. The below-range represents Relativity Space’s current good-faith pay scale for this role. Relativity Space reserves the right to modify or update this range at any time. Compensation is only one part of our entire total rewards package. To see some of the benefits & perks we offer, please visit here: https://px.sequoia.com/relativityspace Hiring Range: $108,000—$138,000 USD"
https://www.indeed.com/viewjob?jk=91c5f931dcb848c3,indeed,Systems Administrator,Cosm,https://www.indeed.com/cmp/Cosm,"Los Angeles, CA, USA",fulltime,2023-12-03,,,,,False,0,,,"Cosm is a global technology company that brings experiences to life in immersive environments. We help our partners create spaces and content that blur the lines of real and virtual across three primary markets: Sports and Entertainment, Science and Education, and Parks and Attractions. Cosm was born from the fusion of some of the greatest innovators in the history of technology. Evans & Sutherland, Spitz, Inc., and Cosm Immersive combined forces to power the immersive experiences of the future as Cosm. Innovation is in our DNA. Summary: Cosm is seeking a skilled Systems Administrator to join our Venue IT Infrastructure team. This key role involves building and maintaining the infrastructure for our new entertainment venue and global operations center. The successful candidate will be tasked with designing, deploying, operating, and maintaining the system architecture for both the venue and the operations center. We are looking for an individual with substantial experience in Windows OS, Active Directory, Office 365, VMware, Okta Single Sign-On, cloud systems, storage infrastructure, and automation. Additional familiarity with systems specific to entertainment venue operations, such as Food & Beverage (F&B) and Ticketing systems, will be highly advantageous. This position is ideal for a team-oriented professional with a strong background in systems administration, eager to contribute to the development of our innovative entertainment spaces. Responsibilities Collaborate with leadership, engineers, and vendors to build new solutions for On-Premise and SaaS providers (AWS) Design and implement all services for new venue buildout including domain, AD, DNS, alerting, monitoring, storage systems, SaaS-based services, and many others. Contribute to high-level strategic decisions with the rest of the engineering team. Act as part of the Ops Center team as Tier 2 and 3 support in monitoring the overall infrastructure for all venues. Provide quality documentation and training on system designs, best practices, and operational procedures to other system admins and IT Specialists. Drive efficiencies through process automation to optimize operations and ensure service uptimes and adherence to internal SLAs. Participate in remediation efforts, performing system maintenance, and regular patching. Proactively monitor KPIs and address areas of improvement Participate in efforts to increase monitoring, logging, and signaling capabilities Experience: 6+ years of experience in IT 4+ years of experience as a Systems Administrator, or relevant experience. 2+ years of Microsoft Systems administration in an enterprise-level environment (AD, DNS, DHCP, etc). 2+ years of VMware administration, backup and maintenance (vCenter, vSphere, vMotion, etc). 2+ years of experience with writing scripts and IT process automation – PowerShell, Python, etc. 2+ Experience with identity management infrastructure/architecture with multi-factor authentication (Okta) with an understanding of standard authentication protocols such as LDAP, Active Directory, SAML, and OAuth. Experience with ServiceNow ticketing system. Experience with monitoring and alerting systems including, LogicMonitor, Grafana, Xmatters, etc. Experience with Networking Infrastructure, WAN Design, and Administration. Experience with cloud architectures, and platform such as Docker, Kubernetes, AWS in a multi-region deployment. Experience with automation/configuration management software (Ansible, Salt, Chef, etc..). Microsoft Certified: Server Administration, AD, etc Bachelor’s degree in Computer Science, Computer Information Systems, Management Information Systems, or a related field or equivalent work experience. Knowledge of ITIL best practices. Ability to quickly grasp technical issues and offer solutions. Excellent verbal and written communication skills. Outgoing and enthusiastic personality. Available for overtime and weekends as the schedule varies depending on site operational needs; flexibility required. Must be able to work during a live production, with loud noise levels, and busy environments (non-office environment) Ability to maneuver around an entertainment venue and walk, stand, sit, bend, stoop, squat, and stretch to fulfill tasks. Must have finger dexterity to be able to operate office equipment Comfortable lifting heavy objects up to 40 lbs The annualized base salary range for this position in California is $80,000-$95,000. The base salary offered will factor in internal equity and may also vary depending on the candidate’s geographic region, job-related knowledge, skills, and relevant experience, among other factors. Cosm is an equal opportunity employer. We celebrate diversity and are committed to creating an inclusive environment for all employees."
