job_url,site,title,company,company_url,location,job_type,date_posted,interval,min_amount,max_amount,currency,is_remote,num_urgent_words,benefits,emails,description
https://www.ziprecruiter.com/k/l/AAJnYNwsjSlLAcS7KM4TmGQ7uTWAFEZ3At9ikP94xENHA97jwoCbYX_SL3WL95CpN5C670_tyQHhBpvHY3mWmRv3FGlyTCEChfWAMLi5xLutRdBIqJ-KyzDZuuVFZKilJv81_wGn9aLUfqIPi_EK-buvpn_AEhk8VN4RWnRHN1PQCcYJOBovIZCmEf91_DHXoDkpZ_zmibQp_Dl60_YjHT0,zip_recruiter,Systems Engineer,Cybrex LLC,,"Norfolk, VA, USA",fulltime,2023-12-04,yearly,76557,104310,USD,,0,,,"Cybrex is in the process of bidding a new Cyber/IT Services Proposal and is sourcing for potential staff. This position is one of many where we are accepting applications, doing interviews and making contingent employment offers with negotiated salary amounts. Upon a win the Contingent offer would become a permanent offer at the previously agreed upon salary. Positions are located in the Hampton Roads area and would follow the particular bases COVID protocols which might mean working remotely or on-site. It could also mean that at some time in the future any remote work would move to the activity you would be supporting. In several of these positions there are multiple experience levels required, which are noted below with any educational or experience requirements so please review position descriptions carefully, many positions will require certification under the Cyber Security Work Force (CSWF) program certification criteria specified in DoD 8570.01-M, in some cases they are noted in the position description in others the government has not yet made that determination, once known this information will be communicated to selected candidates, it would be safe to assume that at a minimum an IAT (Information Assurance Technical) Level II certification as specified in DoD 8570.01-M would be required:Systems Engineer II -At least 4 years of experience in the field or in a related area. Familiar with a variety of the fields concepts, practices, and procedures. Relies on extensive experience and judgment to plan and accomplish goals. May lead and direct the work of others. Performs a variety of complex project tasks applied to specialized technology problems. Tasks involve integration of electronic processes or methodologies to resolve total system problems or technology problems. Applies analytical and systematic approaches in the resolution of problems of work flow, organization, and planning. Directs and assists system engineers in the application of system engineering principles to the solution of secure systems design problems. Expert knowledge of LANs, WANs, VPNs, routers, firewalls, network protocols, and other security and network operations and monitoring, vulnerability analysis, PKI, data encryption, key management, data warehousing, and data mining capabilities. Systems Engineer III - Bachelors Degree in STEM and at least 7 years of experience in the field or in a related area. Familiar with a variety of the fields concepts, practices, and procedures. Relies on extensive experience and judgment to plan and accomplish goals and independently performs a wide variety of complicated tasks. May provide consultation on complex projects and is considered to be the top level contributor/specialist. May lead and direct the work of others. Performs a variety of complex project tasks applied to specialized technology problems. Tasks involve integration of electronic processes or methodologies to resolve total system problems or technology problems. Applies analytical and systematic approaches in the resolution of problems of work flow, organization, and planning. Directs and assists system engineers in the application of system engineering principles to the solution of secure systems design problems. Expert knowledge of LANs, WANs, VPNs, routers, firewalls, network protocols, and other security and network operations and monitoring, vulnerability analysis, PKI, data encryption, key management, data warehousing, and data mining capabilities."
https://www.ziprecruiter.com/k/l/AAJJgbD1cbq657Q9pjbZZbiG-NudPdSKj0zNzuET4YhI9HYKL_rw303cC1E94V7WERDXJm26_xRN_CRPiO8KjjRP2N--7I1fQh25c0e-AoJA8tR_a1USB4Lj4-WoqCis50ZYUA02JwIBeGol5QEEenr_I1ySTjOQgXNFPIA4aUJCNVvjOUdVRgVd9_jL-Ep1yVUET2bBEGwmQ854BGiaWV9qzGZHUpKnwXB4VA,zip_recruiter,Audio-Visual Systems Programmer,VIcom,,"Virginia Beach, VA, USA",fulltime,2023-12-04,,,,,,0,,,"JOB POSTINGAudio-Visual Systems Programmer VIcom - Virginia Integrated Communication – Virginia BeachDepartment: AV - Virginia BeachReports to: Audio-Visual Integration/Service ManagerWe are seeking an experienced professional Audio-Visual Systems Programmer responsible for the programming, testing and support of complex audio-visual systems for control, audio DSP and other equipment/software related configurations. The successful candidate will have a history of designing clean and functional program interfaces that allow for the best user experience for performance and control of complex systems. This position will provide support for remote office/in-office pre-stage system testing/configuration, as well as customer remote and onsite testing/commissioning support in a variety of customer environments.Employee Owned. Customer Focused. VIcom is an industry leader dedicated to providing customers with complete integrated solutions and services through every outlet from - initial planning, consultation, design, integration, and implementation. Our innovative solutions allow organizations to integrate voice, video, data, and security communications to operate more efficiently and effectively with no compromise in quality or reliability.Essential Duties and Responsibilities:Work with Solution Engineer team and customer to gather system program functionality requirements and preferences.Programs Crestron, Q-Sys, Extron, and RTI systems.Programs Audio DSP with Biamp, Q-SYS and other systems.Performs thorough testing and commissioning of all systems both in office and onsite.Supervises in-house rack resting and equipment setup for assigned projects.Provides remote support to Technicians and Field Engineers for integration of systems.Performs remote and onsite service support as needed for completed integrated systems as part of our ongoing Technology Management Support Plans.Coordinates with Engineer, Integration Manager, and Project Manager on system scope and design.Create user guides for customer system operation and provide end user training.Additional Duties and Responsibilities:Continually work to improve customer service perception, and satisfaction.Document internal processes and procedures related to duties and responsibilities.Capture configurations and programs created within our system.Enter time and expenses as they occur.Closes jobs in conjunction with Project Manager.Support of creating technical standards, process/procedures.Complete training programs and gain certifications as required.All other duties and or responsibilities as assigned by supervisor.Knowledge, Skills, and/or Abilities Required:To perform this job successfully, an individual must be able to perform each essential duty satisfactorily. The requirements listed below are representative of the knowledge, skill, and/or ability required. Reasonable accommodations may be made to enable individuals with disabilities to perform the essential functions.Crestron/Extron/Q-SYS, Poly, Biamp, Shure, Vaddio, Zoom, Teams etc... Manufacturer-Software Experience/Training.CTS certification.Ability to read and understand project drawings and schematics, engineering notes, and operation manuals.PC literacy to include Microsoft Office applications, MAC experience helpful.Experience performing each of the job responsibilities outlined above in an associated industry.Demonstrate effective communication skills using tact and courtesy along with the ability to manage pressure sensitive situations.Demonstrated ability to work without direct supervision.Working knowledge of networking fundamentals such as TCP/IP addressing, firewalls, routers, VPN and Vlan setup in an AV/IT environment.Good interpersonal and time management skills.Must be detail oriented, have multi-tasking abilities, and handle tight, high stress deadlines. Candidates must be able to work multiple shifts given including days, evenings, overtime, and some weekends based on project deadlines.Ability for some travel to complete assignments.Professional presentation and demeanor.3 to 5 years+ in Audio-Visual system field installation and integration.3 to 5 years+ in Audio-Visual Systems programming of Crestron and other top control systems, DSP Audio etc...High school diploma or equivalency required / College degree in technology a plus.Have/maintain a clean driving record and valid driver’s license.Ability to pass a criminal background check.Excellent benefits package including health insurance, 401K savings and Employee Stock Ownership Program.   VIcom is an Equal Opportunity Employer committed to creating a diverse environment. All qualified applicants will receive consideration for employment without regard to race, color, religion, gender, gender identity or expression, sexual orientation, national origin, genetics, disability, age, or veteran status."
https://www.ziprecruiter.com/k/l/AAIrwhXS9eRtP9thQiyToTyltn4wHORf6ruCWAlzpiUI58i_hzJrDQfKgx2isEe33HwRRQy0KZ2BweBqKnhDwMW5CUdt-EpKIvho19e8AbNFVkeUUz_YzU_qF8sTXK2Jbb9en9UpXM_i6TNpk8N0cY7tEvhrijIXqhmgLXo0wEpFC4YJyC1PlF4CltRACD4OtVgQV0MbXpGjx-ZouCUVrg,zip_recruiter,Systems Engineer IV (3657),"Gateway Ventures, Inc.",,"Virginia Beach, VA, USA",,2023-12-04,,,,,,0,,,"G VI , a subsidiary of Three Saints Bay, LLC, and a Federal Government Contractor industry leader, is seeking a Systems Engineer IV. Position Requirements: * Master's level degree in an Engineering ..."
https://www.ziprecruiter.com/k/l/AAJB7QPEYp1T2kSSAPdyeLdaqa6fIs0--0F5IKEeNwpbXATcqhxYlKr33jWpBdsNY8KPZf7ef8m0IS61jGU_x9r0aB1xM5GtTw21cy6jl1itDlCeVbcQ8kvt5oUsco4Y5-UoxKKo_FvZJMdPBkoSNAIaiNla8fnU7rUhdEyFVeRJAm9rYLy-oZoowD-emg9SYh5HJ7Ya--D6wwWUtG7_cZPYwFVGtCAixhKFKA,zip_recruiter,Network Security Engineer,Imagine One Technology & Management,,"Norfolk, VA, USA",fulltime,2023-12-04,yearly,80000,100000,USD,,0,,,"***THIS POSITION REQUIRES AN ACTIVE ""SECRET"" CLEARANCE --- U.S. CITIZENSHIP REQUIRED***Imagine One is currently seeking qualified Network Security Engineer III individuals to join our team to provide Network Security Engineering Support to Naval Surface Warfare Center Dahlgren Division, Dam Neck who supports the Program Executive Office Unmanned and Small Combatants (PEO) providing cybersecurity engineering support, cybersecurity requirements Software Support Activity support for the Littoral Combat Ship (LCS) class Environment (TSCE) networks, LCS Afloat Sites for PMS 501 (New Construction), Service), and IWS80 Littoral Combat Ships( LCS). Work will be on-site at Naval Air Station Oceana Dam Neck, Virginia Beach, Virginia with 20%-30% travel potential Marinette, Wisconsin; Jacksonville, FL; San Diego, CA.The Network Security Engineer III will provide ongoing network support, addresses availability issues, overcome performance problems, and provide overall level 2 support. Designs, installs, maintains and coordinates the use of network systems. Evaluates hardware and software and peripheral equipment for large, complex networks to include the following responsibilities:Responsibilities for Network Security Engineer III:The Network Security Engineer III would serve as a Littoral Combat Ships (LCS) Network Security Engineer at NSWCDD DNA. The Network Security Engineer III will provide network-engineering support to pre-delivery and in-service LCS ships. The selectee will serve within a team of engineers for the LCS Total Ships Computing Environment (TSCE) core business network and provide support for the LCS Software Support Agent (SSA). He/she will perform network engineering, integration, evaluation and testing within the LCS TSCE core business network. He/she will perform networks security updates upgrades to ensure the security and integrity of the TSCE network. Network Security Engineer III will analyze, troubleshoot and resolve issues with the LCS TSCE infrastructure including devices such as routers, switches, and firewalls. The Network Security Engineer III will perform all duties associated for support, maintenance, performance and uptime of the LCS TSCE core infrastructure to include as follows:Provide network security engineering support to PMS 501/505 and IWS80 for implementation of Cybersecurity Ships Change Documents (SCDs) and Engineering Change Proposal (ECPs).Provide engineering and network architecture expertise for pre-delivery/in-service ships for integration and modernization efforts.Perform security/vulnerability assessments using DoD provided tools; reporting results to the lead cybersecurity system engineer.Provide oversight for the day-to-day management and maintenance of the LCS core network infrastructure.Perform firewall and network device support for the TSCE core infrastructure.Oversee in the deployment of switches, routers, firewalls, and storage devices from multiple vendors.Support and interact with the network cybersecurity engineers, system administrators, and system engineers to ensure the confidentiality, integrity, and availability of systems, networks, and data.Assist with network engineering executing activities such as the design, implementation, installation, configuration, maintenance, integration, and analysis.Assist in the management and maintenance of lab facilities.Apply software patches and patch sets during maintenance windowsIncludes operating system (OS) patches released from DISA’s patch repository website.Upgrade software.Conduct regression testing Required QualificationsRequires five (5) years with BS/BA or minimum zero (0) to two (2) years with MS/MA/MBA or eight to ten (8 to 10) years with no degree.Minimum certification as 461 at the Intermediate level per DoDD 8140.01, or successorInformation Assurance Technical (IAT) Level II certificationMinimum of five (5) years’ experience in Network EngineeringDemonstrated experience with Windows OS and Linux OSDemonstrated experience with performing STIG implementationDemonstrated experience performing vulnerability assessments with the Assured Compliance Assessment Solution toolMust have hands-on technical experience in the following areas:Network Routing ProtocolsCisco Adaptive Security Appliance (ASA) FirewallsExtensive experience with Access Control Lists (ACLs)Experience with Cisco security devices focusing on Identity Services Engine (ISE), Web Security Appliance (WSA) and Email Security Appliance (ESA)Demonstrated experience troubleshooting network connectivity issuesMust have experience in Network Security to include the design, implementation, configuration, and enforcement of security controls on network, hardware, and software components and devicesExperience with the implementation of cybersecurity and Information Assurance (IA) boundary defense techniques and various IA-enabled appliances (firewalls, Intrusion Detection Systems (IDS), Intrusion Prevention System (IPS), switches/routersKnowledge of computing and networking vulnerabilities, attack methods and latest detection methodsExcellent ability to communicate effectively orally and in writingPreferred Qualifications:Served on a LCS platformWindows Server upgrade experienceHBSS knowledge is a plusExperience utilizing packet analyzer tools such as Wireshark and tcpdumpHyper-V or VMware experience is a plusAlcatel operating system experience is a plusSecurity Requirements:U.S. Citizenship required.Candidate must have an ACTIVE SECRET clearance (with TS/SCI eligibility)Imagine One offers a full package of benefits and competitive salary, excellent group medical, vision and dental programs. 401K savings plan; $4K annual tuition reimbursement ($5K if pursuing Master’s degree); employee training, development and education programs; profit sharing; advancement opportunities; and much more! ISO 9001:2015, ISO 20000-1:2018, ISO 27001:2013CMMI Development Level 3An Employee-Owned BusinessEEO/AA Employer. Protected Veterans and individuals with disabilities encouraged to apply."
https://www.ziprecruiter.com/k/l/AAI75O8daLOJ2MHKuoEvniKb4Yuz353TScb-LiQBb4VTZnGMy7h3Iq5Aj7eccPGvyFcfdLLjtzJ0ooIbD-9ZVesEYb2SIk0cwytRdEjMlRpQcWlrjPihGnExi_8GusxRU9xQduz7jcPOR_blFuUOYZt3lJnH5PYEQuUs5gG_UZvgCNBmbQTIp9_7chAIR657OVfOo_ShJe8wmTpdJ8MjXqlVtC-ixFTzZz1e-A,zip_recruiter,"Audio Visual VTC Engineer - Virginia Beach, Va",iSoft Solutions,,"Virginia Beach, VA, USA",fulltime,2023-12-04,yearly,70000,120000,USD,,1,,,"iSoft Solutions (iSoft) is an industry leader dedicated to providing Government customers with turnkey integrated solutions and services through every outlet from - initial planning, consultation, design, integration, implementation and post-install support. iSoft is currently seeking a Professional Services Engineer (PSE) to support the continued growth of our Audio Visual – Network Technology group headquartered out of Virginia Beach, VA. Recent technical experience is REQUIRED; experience in the Federal Government sector is strongly preferred. Project / account coverage may span the continental U.S. with a focus in Southeastern Virginia, and the Mid-Atlantic region (VA / NC / MD / DC). A Govt Security Clearance is preferred. The ability to obtain a US Government Security Clearance is required (i.e., background check).As a PSE, you must exemplify exceptional communication, organization, and leadership skills with strong technical experience in the integration of audiovisual, video conferencing and closely related technologies to support the delivery of turn-key solutions. Duties of your position include but are not limited to the below. Other duties may be assigned as needed to support the overall mission of iSoft or service delivery customer requirements.Core Responsibilities:Assist the Project Manager to schedule, manage, and coordinate the available labor, materials, tools, equipment, transportation, and technical expertise for a successfully implemented AV/VTC project.Collaborate with the Service Manager and Logistics & Service Administrator regarding the overall planning and allocation of resources for upcoming projects.Conduct internal and external (customer site) kick-off meetings.Conduct internal project recap meetings.Review engineered drawings and statements of work prior to project implementation, and collaborate with Engineering on any questions, considerations and potential changes prior to start of project.Serve as back-end support to technicians for addressing project questions and concerns and provide escalated technical support on site as needed.Provide software configuration and programming functions and support (ie. VTC, DSP, control system programming).Responsible for testing and commissioning of systems.Perform QA/QC checks onsite and provide constructive feedback / guidance to technician crews.Successfully plan, implement, test, train, and close audiovisual and VTC projects within the budgeted timeline provided. Assist in obtaining customer sign-off at completion.Occasionally perform pre-engineering site surveys and provide the in-house dedicated engineering team with all necessary information to effectively design A/V solutions for the end user.Maintain and update technical and project documentation to reflect every aspect of the project’s progress.Support both new project installations as well as maintenance/service requirements as required.Manage projects on-site while overseeing and, at times, participating in the physical installation of the following (but not limited to): large displays, video walls, projectors and screens, Smart boards, speakers, amplifiers, audio/video switchers, mixers, DSP’s, microphones, control systems, and video conferencing units.Read and interpret blue prints, drawings and schematics.Mark up AV design drawings and documents to reflect actual field (installed) conditions for the purpose of accurate as-built development.Assist in tracking equipment inventory, recording serial numbers, and delivering equipment.Work in varied conditions including outdoor environments and confined spaces. Erect and work on scaffolding, tall ladders and motorized lifts.Oversee the daily activities of projects and technician crews assigned to multiple concurrent jobs as well as provide the iSoft Service Manager and Customer liaison with all necessary updates throughout project at a frequency determined by your supervisor.Conduct work in compliance with national, state and local OSHA electrical and safety codes; telecommunications industry standards; materials manufacturer specifications; and customer requirements.Be available to travel for out of town projects for extended periods of time.Be flexible for working off-hours and overtime as required by project deadlines, including nights and weekends on a limited basis.Base Qualifications and Requirements:High School Diploma or equivalent.One year college level basic electrical/electronic study or completion of formal military basic electrical/electronic training.At least five years of dedicated Audio Visual experience.Audio DSP programming experience or training preferred.Control system programming experience or training preferred (Crestron, Extron, AMX).Needs to be Self-sufficient, self-motivated, organized, reliable, with excellent work ethics.Needs to be detail oriented, have multi-tasking abilities and handle tight deadlines and challenging customer or job environments.Audiovisual/videoconferencing manufacturer experience and training, certifications a plus.Proficient in Microsoft Office.CTS Certification required.Physical condition to perform job duties including seeing/hearing; feeling/handling/reaching; bending / crouching / squatting / kneeling / pushing / pulling / lifting / carrying weights in excess of 70 pounds (heavy work); tolerance for prolonged walking or standing on various surfaces and/or work on ladders or aerial lifts.Work methods must be in compliance with national, state and local electrical and safety codes; telecommunications industry standards; materials manufacturer specifications; and customer requirements.Currently hold Secret Clearance or have eligibility to immediately attain a Security Clearance to support our DoD clients.This is a leadership role – soft skills for interacting with co-workers and customer is an absolute must have."
https://www.ziprecruiter.com/ek/l/AAIoa8v1CgCyRhFsdr29Ex0cY-vNrTeSzSPAtHRQ73wDf4TgyicdYCdXMZ1JFdRkJod4hAz7qykPdbKRXnKPEU_Zl-dW4G1ft7O9p1rrfRmr6pSl0mQS_9oAhnduHPLrcldHfpxAfbFivz8vb8C4EEJ_jV6ILDCVtU_xz3RURpoBVzAc77owFsxtilxnKGHBxQ2GdAGf3Sxx70HIfXI6wPdsVKIaLE-5VwssYQ,zip_recruiter,On-Site Machinist,Collins Machine Works,,"Portsmouth, VA, USA",,2023-12-04,hourly,19,26,USD,,0,,,"A strong, proven interest in engineering and mechanical systems. * Read blueprints and measuring tools. * Ability to perform basic mathematical computations. * Ability to apply concepts such as ..."
https://www.ziprecruiter.com/k/l/AAJDQA7dT5K3ki-UFAFEXQz8lH8OitxGW1nkEUfY4nCoKSMktwBc3df9-j726F7z_wQ3Fb_-mBNIpC7zCChWsDNL6f3GC8wkJfwF23eCjAJ0VEY1PYDish-DRYVdgD7SOxsEDahsrlZdvjzPVTtl12nLoe68IBnX3EIvdz6yzsOIgZ0gW4qa3cfzid9NCGyKpwd7AsDGPSAeTwTev_dgtA,zip_recruiter,Systems Engineer III,City of Virginia Beach,,"Virginia Beach, VA, USA",,2023-12-04,,,,,,0,,,The Systems Engineer will manage the City's network which includes cloud networking and leading a team of network engineers. The candidate will work with various members of the Infrastructure and ...
https://www.ziprecruiter.com/k/l/AAKBmBYbJ2VokASp8lZ4c6CvZD2A7RL-2OweBZTYfxDGar9Amzm3MKI7LjWQIPhac6KJDaZ6vSOiQdBQA47VizjgHXqSRBYaX27g0I1ujC7654VVrkVfDATHDv96IlbZv31aNrAn6_mlmcGytYuneAXmrjtncEpebLZvENIQEdBAJJxxeiLZq0EPkbeHr224_RkS2ECFTeTXO2J0veKUTCA,zip_recruiter,INTERDISCIPLINARY (COMMUNITY PLANNER/GENERAL ENGINEER/ARCHITECT/CIVIL ENGINEER/INDUSTRIAL ENGINEER),Naval Facilities Engineering Systems Command,,"Virginia Beach, VA, USA",,2023-12-04,yearly,84546,84546,USD,,0,,,... systems and automated databases to capture spatial or geographic data to support facility planning ... FOR THE ENGINEER/ARCHTECT SERIES: You must possess a Professional Engineer (PE) license if applying ...
